videoId,publishedAt,authorDisplayName,textDisplay
lifo3qKUaFc,2023-09-24,Cees Wille,"Beste redactie, een tip ik adviseer jullie om ook korte stukjes er uithalen en te uploaden (de shorts) makkelijk om te delen en kan ook beter de aandacht grijpen van de sociale media gebruikers! Voor de rest is dit een prima podcast en ik voel mij erg op het gemak en gelukkig bij het CDA met Henri als lijsttrekker. Helaas kon ik niet op het congres zijn, de Hannie van Leeuwen lezing heb ik wel bijgewoond toen had ik Henri niet aan gesproken. Ondanks dat hoop ik Henri snel een keer persoonlijk op een evenement te ontmoeten! 😊💚"
C-SkOUO3BOg,2023-09-24,Quinten Ebben,Keurig gesproken heer wilders. November heb je mijn stem.
-7rTJUXQLDU,2023-09-24,Dennis Bouma,Deze bal maat het wel erg bont
DTWHvrQ6h0k,2023-09-25,Gitareur,"Het CDA beroept zich op de Bijbel waar de kern van het Christelijk geloof in verwoord wordt. O.a. ""heb uw naaste lief als uzelf"". Ik kan dat niet rijmen met de uitspraken van deze als lichtgewicht overkomenden Christen. Heel verdrietig."
C-SkOUO3BOg,2023-09-25,Twan van Dijk,Geef jou maandsalaris aan de Oekraïners
C-SkOUO3BOg,2023-09-25,Teun,Wat een onkunde bij het CDA 😢
C-SkOUO3BOg,2023-09-25,Oompball,Welke land dan Nederland heeft 'minder financiële problemen met de eigen bevolking?'
-7rTJUXQLDU,2023-09-25,M Mulder,"Ik vraag mij af of Henry de komende verkiezingen veel zetels pakt, maar zijn antwoorden zijn genuanceerd ik denk dat veel mensen op de lange termijn wel zal aanspreken."
DTWHvrQ6h0k,2023-09-26,Coen Offerman,"""ik wil dansen, ik heb de hele dinsdagavond niks om handen"" -Henri Bontenbal"
DTWHvrQ6h0k,2023-09-26,Jan Dijk v,"‘Gelukkig zijn de mensen die vervolgd worden omdat zij Gods wil doen, want het Koninkrijk van de hemelen is voor hen.’  ‭‭Mattheüs‬ ‭5‬:‭10‬ ‭HTB‬‬    Tot nog toe ging het allemaal nog wel, was het nog wel te doen, maar vandaag is het toch wel erg lastig! Blij zijn als je je vervolgd wordt, als men liegt over je, en dan met name om je dwars te zitten, omdat ze weten dat je bij Jezus hoort en wil doen wat Hij zegt."
C-SkOUO3BOg,2023-09-26,Bert aan den Boom,Geert Wilders is the man❤💯🤝🏻
C-SkOUO3BOg,2023-09-26,Wesly de Kort Sterkste Man Training,Wij hebben niks met die landen te maken!
C-SkOUO3BOg,2023-09-26,Annette Langerhorst,Het is onbegrijpelijk dat in onze beschaving nog steeds wapens worden geleverd ipv vredesonderhandelingen
C-SkOUO3BOg,2023-09-26,sonja blom,CDA weg wezen
C-SkOUO3BOg,2023-09-26,Murat Soydas,Normaal heb ik niks met Wilders maar hij heeft hier wel een punt
C-SkOUO3BOg,2023-09-26,pallas12345,Precies al onze centen moeten naar overal en anders moeten de centen naar iedereen die hier komt
C-SkOUO3BOg,2023-09-26,etienne Baree,"hij kan zelf ook in de loopgraven gaan staan, een beetje geld geven en ik ben er vanaf .. :-)"
UoRAxojF4lQ,2023-09-27,kleermaker1000,"Wie wat beter kijkt en er wat meer kijk op heeft, ziet duidelijke verschillen tussen de koers van Omtzigt en die van de Boerenclub (lobbypartij en super opportunistisch) en het CDA (altijd rechts van het midden)."
UoRAxojF4lQ,2023-09-27,Alexander van Eijken,Je zou toch verwachten dat uit protest andere gasten e.e.a. blijkbaar geen probleem vinden.
UoRAxojF4lQ,2023-09-27,voor naam,Onzin praatjes maar ja de tijd moet gevuld worden...
UoRAxojF4lQ,2023-09-27,voor naam,Bbb heeft andere standpunten.
UoRAxojF4lQ,2023-09-27,Kris M,En dan heb je nog CDA forte: de SGP.
UoRAxojF4lQ,2023-09-27,Circuitbreaker,die wouter die kraamt me toch eens onzin uit
UoRAxojF4lQ,2023-09-27,Alexander van Eijken,Ik heb begrepen dat mevr. Keyl niet meer welkom is in dit programma om dat zij zich niet schikte  in de voorgeschreven mening. Je zou toch verwachten d
UoRAxojF4lQ,2023-09-27,ThomasSlayer,CDA in schaapskleren
UoRAxojF4lQ,2023-09-27,SinisterMud,Als t maar seculier is!
UoRAxojF4lQ,2023-09-27,just bystander,Wat een gelul sorry. Kan het niet gewoon zo zijn dat die CDAers het niet met de werkwijze van hun partij eens waren . En dat zij er gewoon vooruit komen? Hoeveel van die partij zouden graag eerlijk willen zijn? En het zou me niet verwonderen als de meeste leden een overstap wagen . dus zet m op Pieter mijn stem heb je zo wie zo
UoRAxojF4lQ,2023-09-27,aabee,Bij BNN/Vara is de extreemrechts framing van Pieter Omtzigt al gestart. Hij is niet de lieveling van de gesubsidieerde media en zal het lastig krijgen. Elke struikeling zal eindeloos worden uitvergroot.
UoRAxojF4lQ,2023-09-27,Jerry Blume,Omtzigt:zijn vrouw en broer werken voor het wef .
UoRAxojF4lQ,2023-09-27,Paul Van Amersfoort,Wie vertelt het CDA dat god niet bestaat?...hahahahaha
Lmb5KLaP37I,2023-09-27,Wim,Ben bang dat er veel gelukzoekers en baantjesjagers op deze partij afkomen. Ook zijn veel mensen zich aan het blindstaren op een persoon die teveel geidealiseerd word. De toekomst moet uitsluitel geven.
Lmb5KLaP37I,2023-09-27,Avced,Mooi om te horen dat hij een lijst opportunisten bij elkaar heeft weten te vegen. Zouden die mensen zich ook gemeld hebben wanneer hij in de peilingen op 3 zetels zou staan? De vragen stellen is hem beantwoorden.
Lmb5KLaP37I,2023-09-27,nobody,Ik wil geen nieuw contract maar een echte democratie met echte tegengeluiden. Is dat nou zo moelijk?
Lmb5KLaP37I,2023-09-27,M Mulder,Als NSC de grootste wordt hoeven ze niet de premier te leveren. Ze kunnen ook een kleinere coalitiepartij de premier laten leveren. Dat is al eerder gebeurt in de Nederlandse politieke geschiedenis. Zo leverde o.a. de derde regeringspartij ARP Colijn als minister president minimaal 4 kabinnetten en ook Biesheuvel in 1971
Lmb5KLaP37I,2023-09-27,Frans Frank,ik stem zeker niet op zijn partij het is gewoon cda 2.0 en die hebben er een zooitje van gemaakt waar hij heel lang onderdeel van was.
Lmb5KLaP37I,2023-09-27,katja v Heesch,Nooit met een contract in zee gaan.
Lmb5KLaP37I,2023-09-27,Peetje Lieverd,Weg met PvdA en ook groenlinks  niet mee laten doen
Lmb5KLaP37I,2023-09-27,𝓛𝓪𝓷𝓰𝓮𝓿𝓵𝓸𝓮𝓲🇳🇱,"Met het woordje nieuw, heb ik een probleem, hoe gaat dat werken na 5 jaar, dan is het nieuwe er wel af. Ouwe wijn, nieuwe zak."
Lmb5KLaP37I,2023-09-27,Alexander Breston,Op het weforum een artikel met de titel; why we need a new social contract. De toekomst is digitaal en transhumanistisch. Niets gebeurt zonder uw toestemming.
Lmb5KLaP37I,2023-09-27,Peetje Lieverd,Dit zijn tenminste mens die na denken ik ben er blijf om
Lmb5KLaP37I,2023-09-27,Alko De hond,Eerst zien dan geloven ! Veel beloven maar is het ook waar te maken ? Ik denk het niet zolang Brussel de dienst uitmaakt . Ik denk zolang Nederland binnen de EU valt verwacht ik dat er eerlijk gezegt niets van terecht zal komen. We wachten af .
Lmb5KLaP37I,2023-09-27,Freda De Zwart,"Gewoon cda,jammer.  Rechts is veel beter.  Mensen blijven slapen.  Uit de eu Weg met wef.  Als de eu wat zegt moeten we gehoorzamen.  Wat de kamer ook zegt.  We moeten er gewoon uit"
Lmb5KLaP37I,2023-09-27,Tashi lhamo,Mooi 🌺🌺🌺🌺🌺
Lmb5KLaP37I,2023-09-27,Wolf Blitzer,"Neeee, dit is niet het nieuwe CDA hoor."
Lmb5KLaP37I,2023-09-27,C Vroegejr,Een wolf in schaaps kleren
Lmb5KLaP37I,2023-09-27,Aljosa Popovski,"NSC, go for it!"
Lmb5KLaP37I,2023-09-27,Requiescat,Mijn stem gaat gewoon weer naar BBB.
Lmb5KLaP37I,2023-09-27,hakkelaar,Ik stem daar niet op gevaarlijke partij veel CDA er er in.
Lmb5KLaP37I,2023-09-27,Dutchie,WEF dienaars.
Lmb5KLaP37I,2023-09-27,Jan D,Thierry Baudet heeft steeds duidelijker gelijk. Aarzel dus niet langer en word vandaag nog LID van FVD.
Lmb5KLaP37I,2023-09-27,hakkelaar,Stem rechts voor verandering.
Lmb5KLaP37I,2023-09-27,Jefson,VVD = WEG ER MEE  !
Lmb5KLaP37I,2023-09-27,Jefson,DILAN ERDOGAN .....😂
DTWHvrQ6h0k,2023-09-27,Zicoh Zizo,""" functie elders""  heeft best goed uitgepakt voor jullie 😂😂😂😂😂😂😂😂😂😂😂😂😂😂😂😂😂😂"
DTWHvrQ6h0k,2023-09-27,Jeroen Bezuijen,"Fatsoenlijk en politiek, gaat dat samen? Nee, dus!"
DTWHvrQ6h0k,2023-09-27,Ciro Di Marzio,Anne Kuik speelt eerst in Oppassen met die opaatjes met Koen Flink
C-SkOUO3BOg,2023-09-27,Astrid Manikus,Goed zo meneer Wilders.top❤
C-SkOUO3BOg,2023-09-27,Jefferson,"Betaald hij ook voor zijn buurman als die een nieuwe tuin wil aanleggen, terwijl zijn kinderen bijna niks te vreten hebben?"
fNjG8q8T-IM,2023-09-28,norma desmond,En Mona blijkt ook wachtgeld te krijgen....
UoRAxojF4lQ,2023-09-28,Bastiaan Stapelberg,Bij Pauw moet ik altijd aan Stoffel de schilpad denken uit de Fabeltjeskrant.
UoRAxojF4lQ,2023-09-28,Theo,Omtzigt het paard van Troje van het WEF.
UoRAxojF4lQ,2023-09-28,Onno Bruynen,Let the framing begin
UoRAxojF4lQ,2023-09-28,Alexander van Eijken,Het ligt aan mij ik weet het maar ik kan dat smoelwerk van de Winther niet meer zien.
UoRAxojF4lQ,2023-09-28,Lidy Sellink,WAnneer gaan jullie het hebben over de oversterfte die is ontstaan na die prikactie begin 2021.?
UoRAxojF4lQ,2023-09-28,Jan van der Lee,"Waarom zien we die Jeroen Pauw toch steeds terug in allerlei praatprogramma's ? Niet gebaseerd op kennis, maar alleen maar op zijn eigen steeds rechtser wordende mening. Met als dieptepunt zijn start voor de Timmermans-basj. Kom op redacties: kom eens met nieuwe frisse geluiden dan te kopiëren van de talkshows die ook elkaar weer kopiëren."
Lmb5KLaP37I,2023-09-28,Pe Rietveld,"Ja inderdaad, oude wijn in nieuwe zakken"
Lmb5KLaP37I,2023-09-28,Corona Wappie,Er is toch maar een goede partij! FvD ❤️
DTWHvrQ6h0k,2023-09-28,AAM Peters,De Tango van het blote kontje(Toon Hermans) verteld over de diepzinnige inhoud van het CDA verhaal ❤❤❤
DTWHvrQ6h0k,2023-09-28,AAM Peters,Henri laat zien wie hij is
y7irqJj-_1Q,2023-09-29,Wolf Blitzer,Maar het midden gaat niet op jullie stemmen.
vPSGsvdBN94,2023-09-29,Jan Dijk v,"De belangrijkste leefregel uit de wet van Mozes  34De Farizeeërs hoorden dat de Sadduceeërs Jezus hierop geen antwoord hadden weten te geven. Daarom bedachten ze een nieuwe strikvraag. 35Eén van hen, een wetgeleerde, ging naar Hem toe en vroeg Hem: 36""Meester, wat is de belangrijkste wet in de wet van Mozes?"" 37Hij zei tegen hen: ""Deze: 'Houd van je Heer God met je hele hart, met je hele ziel en met je hele verstand.' 38Dat is de eerste en belangrijkste wet. 39De tweede, die net zo belangrijk is, is deze: 'Houd net zoveel van je broeders als van jezelf.' 40De hele wet van Mozes en de boeken van de profeten gaan over deze twee wetten.""  De Zoon van David  41Terwijl de Farizeeërs zo om Jezus heen stonden, vroeg Jezus hen: 42""Wat denken jullie van de Messias? Van wie is Hij volgens jullie de zoon?"" Ze zeiden tegen Hem: ""Van koning David."" 43Toen zei Jezus: ""Hoe kan het dan dat David Hem door de Heilige Geest 'Heer' noemt? Hij zegt namelijk in één van de Psalmen: 44'De Heer heeft tegen mijn Heer gezegd: 'Kom naast Mij zitten, totdat Ik al uw vijanden helemaal verslagen heb.' 45David noemt Hem 'Heer'. Hoe kan Hij dan zijn zoon zijn?"" 46Daar wist niemand iets op te antwoorden. Vanaf die dag durfde niemand Hem nog iets te vragen."
UoRAxojF4lQ,2023-09-29,Docent Vo,"Eenieder hier is bang voor zijn baantje. Beeldvorming en framing in krant, tv en online is waar het om gaat. Presentatie, kernwoord, organisatie, aardig vinden. De kiezer moet leren om naar de feiten te kijken en zich niet door dit soort type  'duiders' laten leiden."
JvjgjBCorgo,2023-09-29,Leendert Weggeman,Deze Leendert denkt ook dat het cda een verrassing gaat brengen.
C-SkOUO3BOg,2023-09-29,Robbie Lemmens,"Klasse Geert , ooit kom er een tijd dan is het echt te laat voor alles 😢dan gaan ze zeggen , hadden we maar iets meer naar Mr Wilders geluisterd 😉daarvoor steun ik U al jaaaaren 🫶🏼"
tooEMr_fwfY,2023-09-30,B Fiftytwo,Relaxde gast wel. Gaat lekker ontspannen met kritiek om 😉
tooEMr_fwfY,2023-09-30,Ben Staal,"Bontebal is gewoon een aanhanger van de GroenLinks ideologie, weet waar u op gaat stemmen!"
tooEMr_fwfY,2023-09-30,Wim van Dongen,CDA loopt naar mijn mening gewoon leeg .Niet te veel aandacht meer geven.
tooEMr_fwfY,2023-09-30,Lekkerscrollen,Wilfred genee is echt zo’n slechte interviewer. Hij wilt zelf gewoon graag praten.
tooEMr_fwfY,2023-09-30,Daan,Bontenbal vind zich zelf wel erg goed
tooEMr_fwfY,2023-09-30,B Fiftytwo,Zo te horen is  hijzelf  de grootste fan van zichzelf .
tooEMr_fwfY,2023-09-30,Robert Spanjaard,liegen en bedriegen dat doen ze bij dit CDA en wordt alleen maar erger
tooEMr_fwfY,2023-09-30,hinderikus bos,"Ik vind bontenbal positief en de vragen , te hard . Misschien is het ook wel mede onze eigen  schuld dat de  politiek te glad is geworden . Te harde vragen , en bij voorbaat te weinig luisteren naar inhoud . Ik ben ook best wel hard en direct geworden door ervaringen en geitepaadjes ."
tooEMr_fwfY,2023-09-30,Leven is bewegen,"Het parlementarisme, ofwel de officiële toestemming om uit vijf meningen te mogen kiezen, vindt ingang onder de   die graag de indruk wekken zelfstandig te zijn en voor hun mening willen vechten. Maar uiteindelijk is het om het even of de kudde 🐏🐑een mening krijgt opgedrongen of dat vijf meningen zijn toegestaan. * Friedrich Nietzsche"
tooEMr_fwfY,2023-09-30,B Fiftytwo,Is hij het leiderschap nu al spuugzat?😅
tooEMr_fwfY,2023-09-30,Bart Jaja,CDA het enige wat telt zijn zetels links of recht om Ze verkopen hun ziel voor een zetel 😂
tooEMr_fwfY,2023-09-30,Arthur de Vrome,CDA kleiner dan ChristenUnie. Mentaal nog steeds 40 zetels! 💫
tooEMr_fwfY,2023-09-30,Borgio Besieger,Iedereen was CDA zat daarom heb je nu CDA 2.0 en CDA 3.0 😮  Ik sla ze alle 3 wel over 😂
tooEMr_fwfY,2023-09-30,VPN Consult,Hoop gebral.
tooEMr_fwfY,2023-09-30,Robert Spanjaard,"pffff o wat is hij zielig, pffff start al goed"
tooEMr_fwfY,2023-09-30,renate kleefstra,"""geluiden uit het Kippenhok"""""
tooEMr_fwfY,2023-09-30,JSK010,Och Henri.. authenticiteit en lekker jezelf zijn is alleen boeiend voor de kijker/kiezer als je een interessant en markante persoonlijkheid bent
tooEMr_fwfY,2023-09-30,Jean-Louis Gordijn,"Mijn lieve hemel, Sanne Wallis de Vries. Ik word hier zo treurig van. Een BNNVARA coryfee. Hoe diep kan je zinken."
tooEMr_fwfY,2023-09-30,Dorus ,Wat een gek weer. Gelukkig geeft hij toe dat alles mis is gegaan
tooEMr_fwfY,2023-09-30,F.R. Schmahl,Hij redt het niet. !!!!
tooEMr_fwfY,2023-09-30,maartos,Bontebal? Never heard of her!
tooEMr_fwfY,2023-09-30,Piet Hendriks,wij zijn CDA  spuugzat
tooEMr_fwfY,2023-09-30,B Fiftytwo,"Heten critici , jullie begrijpen het niet of luisteren niet goed. Luister nou wat hij zegt : hij zegt dat hij steengoed is! Knoop dat in je oren."
tooEMr_fwfY,2023-09-30,Wim Van beelen,Interessant stukje! Maar die vrouw op de achtergrond Pff niet uitnodigen aan tafel graag bij vi.😉
tooEMr_fwfY,2023-09-30,Broodje worst,Wappies lijden vaak aan narcisme.
tooEMr_fwfY,2023-09-30,JSK010,Tsja. Sneu voor de man misschien maar kiest er zelf voor.
tooEMr_fwfY,2023-09-30,Pe Rietveld,"Ach, wat ben je toch zielig"
tooEMr_fwfY,2023-09-30,Robert Spanjaard,hij liegt in Rotterdam en nu landelijk
tooEMr_fwfY,2023-09-30,daan,Ik ga op NSC stemmen🙃
tooEMr_fwfY,2023-09-30,Paul Van Amersfoort,Aardige man..verkeerde partij..sluit je aan bij Omtzigt!!
fNjG8q8T-IM,2023-09-30,bold,Ze is wel eerlijk ze gaat niet liegen
eR9Ynh4cWeA,2023-09-30,Tim____,stem BBB
UoRAxojF4lQ,2023-09-30,Christine Lohman,Eigenlijk is iedereen in de war.
Lmb5KLaP37I,2023-09-30,Lilith Desdemona,De naam van deze partij  is heel ongelukkig ofwel foutief naar mijn mening. Brengt deze partij het referendum weer tot leven? https://youtu.be/uZOWRbixDPw?si=EfTgZ3C0sATn46Lc
C-SkOUO3BOg,2023-09-30,Marie Jose Romero,Bontenbal is nog gekker dan ik dacht!
C-SkOUO3BOg,2023-09-30,Marie Jose Romero,Goed zo heer Wilders!
C-SkOUO3BOg,2023-09-30,Adrie de Jong,Zelfs in Nederland worden kinderen uit gezinnen geplaats zorg daar eens voor .
C-SkOUO3BOg,2023-09-30,Levien 2006,"egoïsme is volgens die gek van CDA, om aan de Nederlandse burgers te denken wat een gek. Ik loop me hier echt kwaad te maken."
C-SkOUO3BOg,2023-09-30,van alles wat,"Wat betekent democratie nu nog en wat is het nog waard in een land als Nederland waar het volk er niet meer toe doet, waar alles alleen nog maar om NGO's, WHO, VN, EU en het WEF draait? Dus spreek a.u.b. niet over democratie, waar je zogenaamd voor staat, wetende dat het vandaag de dag slechts een herinnering is en niet meer bestaat."
xoAtP3ubZys,2023-10-01,WNL,Lees meer: https://wnl.tv/2023/10/01/cda-leider-henri-bontenbal-wil-importheffingen-op-chinese-elektrische-autos/
xoAtP3ubZys,2023-10-01,Jon Hagedoorn,"Wat heeft Bontebal eigenlijk ""Nog Te Willen"". CDA splinterpartij."
xoAtP3ubZys,2023-10-01,Elisabeth A,Bontebal vergeet toch iets veel belangrijkers. De mensen willen voldoende geld voor eten gas en rekeningen te kunnen betalen. En doe eerst maar eens iets aan de veel te hoge belastingen.
xoAtP3ubZys,2023-10-01,Jan D,Thierry Baudet heeft steeds duidelijker gelijk. Aarzel dus niet langer en word vandaag nog LID van FVD.
xoAtP3ubZys,2023-10-01,R Blom,Zeker geen Chinese studenten op universiteiten laten rondlopen. Niet bij asml etc.. Dat levert ons niks op.
xoAtP3ubZys,2023-10-01,Albert,"Ja hoor, heffing!!!  Lekker meer geld in de schatkist om over de balkte gooien"
xoAtP3ubZys,2023-10-01,Dick Cheesehead,"Nou, wat een held.  Als dit geen 20 zetels worden dan weet ik het ook niet meer."
xoAtP3ubZys,2023-10-01,Super Gando,Ja en dan de prijzen voor Europese auto’s lekker hoog houden.   Nee Bontelul meer concurrentie leidt tot goedkopere prijzen en dus betaalbare Elektrische auto’s.
xoAtP3ubZys,2023-10-01,Pietje Puk,"Heel goed! Dir Chinese auto's worden door dwangarbeid goedkoop in elkaar gezet. En de cobalt voor die accu's worden door kinderen van 8 jaar in de cobaltmijnen van Congo gedolven. Dus als ik moet kiezen voor een ""vervuilende"" Europese benzine auto of een kinderarbeid/dwangarbeid goedkope ""milieuvriendelijke"" Chinese auto is de keuze snel gemaakt!"
xoAtP3ubZys,2023-10-01,red_grapes,Heeft deze man eigenlijk al iets anders voorgesteld dan belastingverhogingen? Zijn oeuvre aan politieke retoriek tot nu toe ziet alleen maar op het verder spekken van de staatskas. Hoe groter de overheid…
xoAtP3ubZys,2023-10-01,Lenie van den Hurk,Wordt irritant net alles de rest  CDA  is verdoemd te mislukken
xoAtP3ubZys,2023-10-01,Richard Vastenhouw,Geloven wij niet meer in de vrije handel???
xoAtP3ubZys,2023-10-01,-OhThatGuyAgain-,Qua mens en leider kan het best een grote worden. Het moet tijd hebben en krijgen. Maar of hij CDA weer op de kaart kan krijgen is moeilijk met de nieuwe partijen BBB en Omtzigt.
xoAtP3ubZys,2023-10-01,we shall never surrender,"Punt van Trump, waar zijn de credits voor hem ❤"
xoAtP3ubZys,2023-10-01,Lidy Sellink,"Ze branden ook lekker ,evenals de zonnepanelen .!"
tooEMr_fwfY,2023-10-01,Cor Willems,Laat deze man eerst even een paar spraaklessen gaan nemen.
tooEMr_fwfY,2023-10-01,jan kruijer,CDA calimero zegt eigenlijk dat het CDA het goed gedaan heeft en gaat een keer terugduwen?
tooEMr_fwfY,2023-10-01,Olivier Koers,De verrassing van het CDA is dat ze ophouden met bestaan.
tooEMr_fwfY,2023-10-01,Luz Oo,CDA is verleden tijd. Hooguit 3 zetels
tooEMr_fwfY,2023-10-01,Tim van Engelen,Bontebal sluit graag mensen uit...
tooEMr_fwfY,2023-10-01,Hendri Hilberink,Ik ben bontebal helemaal zat.😡😡
tooEMr_fwfY,2023-10-01,Wilbtube,"Ach poekie toch, 80% van de kiezers heeft nog niets gekozen? 96% van degenen die gaan komen stemmen hebben hun recensie van het CDA klaar hoor!"
tooEMr_fwfY,2023-10-01,Joke Hagemans,😂niet  op stemmen
tooEMr_fwfY,2023-10-01,Chris Kappert,"He jij BAL , maak het niet te BONT he . 😂😂😂"
tooEMr_fwfY,2023-10-01,Cor,"Sanne Wallis de Vries heeft er ook geen verstand van, zo te horen kan je beter typetjes nadoen  hou je daar bij mevrouw"
tooEMr_fwfY,2023-10-01,marinus lans,Huichelaar
tooEMr_fwfY,2023-10-01,Kees Bergacker,Inhoudsloos gewauwel.
tooEMr_fwfY,2023-10-01,Remco Harms,"Steun uit onverwachte hoek, van Sanne..."
Lmb5KLaP37I,2023-10-01,Jan Wouda,Helemaal wel  ..CDA-light  NSC/BBB
C-SkOUO3BOg,2023-10-01,lorenzoqiara,We moeten weer zelfstandige land worden en weg uit de eu stappen
C-SkOUO3BOg,2023-10-01,joop van derzwaan,De Nederlander die draait er voor op en heeft nooit voor die oorlog gekozen
C-SkOUO3BOg,2023-10-01,Ingrid V,Meer wapens zorgen NOOIT voor vrede
C-SkOUO3BOg,2023-10-01,Huub J,"Als je, als rijk Europees land, Oekraïne niet financieel steunt dan steun je feitelijk Poetin. Iedereen weet dat Oekraïne het in zijn eentje niet zal redden tegen het veel grotere Rusland. Bontenbal heeft helemaal gelijk."
C-SkOUO3BOg,2023-10-01,lorenzoqiara,Mooi gesproken net als toen die tijd als pim fortuijn🎉
-7rTJUXQLDU,2023-10-01,hoi hoi,De ideale schoonzoon meer niet met zijn standaard verhalen.
tooEMr_fwfY,2023-10-02,henk M,Ook zo'n oorlog hitser  die henri toverbal ongeloofwaardig die kerel
tooEMr_fwfY,2023-10-02,Mostn Dokk,ik hoop dat het cda ophoudt te bestaan
tooEMr_fwfY,2023-10-02,DutchMolenaar,De wai partai
lifo3qKUaFc,2023-10-02,Mostn Dokk,Hugo's handpop..
Lmb5KLaP37I,2023-10-02,tiskoman,omtzigt zn familie werkt bij en voor het WEF!
Lmb5KLaP37I,2023-10-02,Bellausu,Nee NSC wordt NSC geen cda gezeur .. einde discussie
C-SkOUO3BOg,2023-10-02,Rob Boyd,"Zijn hier in Nederland geen kinderen uit huis geplaatst, met toeslag affaire? En is dat al opgelost? Zijn de Groningers al gecompenseerd? En wanneer krijgen we kwartje terug van kok?"
tooEMr_fwfY,2023-10-03,LoneSentryMusic,Hij zit er nog niet eens en is het nu al spuugzat. Laat hem gewoon snel oppleuren dan.
tooEMr_fwfY,2023-10-03,Dorus Portugal,Ik denk dat we bontekwal snel spuugzat zijn
tooEMr_fwfY,2023-10-03,Huuske Atadogan,"Bontebal de uitsluiter, sluit Bontebal maar uit. Heel veel woorden maar daden ho maar"
fNjG8q8T-IM,2023-10-03,Peter Grin,Wat maakt het uit ? Je krijgt toch nog gewoon wachtgeld. 🤮
C-SkOUO3BOg,2023-10-04,JKasi,"Als het gaat om het helpen van mensen, dan zouden we ook Russische slachtoffers moeten helpen en niet alleen van die van Oekraïne."
C-SkOUO3BOg,2023-10-04,Jo,Voor onze vrijheid voor hun eigen vrijheid bedoel je? Want ik hoef niet naar die corruptie landen……..🙊
lifo3qKUaFc,2023-10-05,Roland van Terwisga,"Iemand met een minimum loon krijgt geen gratis bier als dat minimum loon verhoogd wordt.  Daar wordt namelijk voor gewerkt en daar hoort eerlijk loon tegenover te staan. Nederland kent daarentegen wel gratis bier voor asielzoekers . Daar trekt deze regering (met de [partij van Bontebal) dit jaar zes miljard EXTRA voor uit. Waar dat allemaal vandaan komt? Geen idee, maar geld is er dus wel."
fX_kB1b_mnA,2023-10-05,Rosa Ghafoerkhan,"Maar de Here zei: ""Ik heb u overgegeven om verkeerde bewegingen te maken""."
So515ayUxQk,2023-10-05,Habib Mirza,Very good
btOgV4j1u2E,2023-10-06,Madhukar Murthi,"Too bad Canada didn't have intel on what Nijjar was up to in plain sight which the entire Indo-Canadian community knew about, reported yesterday in the BC local papers,, it might have made it easier to predict Canada's allies' support during this process."
btOgV4j1u2E,2023-10-06,Mark L,India should support Quebec to breakaway
DTWHvrQ6h0k,2023-10-06,Cr.,In en fatsoenlijk land doet men onderzoek naar schimmige mondkapjesdeals.
vPSGsvdBN94,2023-10-07,Wim,"Fatsoenlijkheid begin bij jezelf. Zorg voor kwalitatieve kamerleden en bestuurders. En ga geen gewone mede Nederlanders uitsluiten,dat is een omisie naar fatsoenlijkheid."
btOgV4j1u2E,2023-10-07,Mike,"Canadian media and diplomats are beating around the bush. Root cause of the problem is Canada  is harbouring anti social and Indian separatist elements. Unless Canada address these problems, forget about good relations with India."
btOgV4j1u2E,2023-10-07,Indian,"Entire Afghanistan, Iraq operation was an extra judicial killing operation. Your terrorist is terrorist, and our terrorist is your plumber? 😂😂😂"
btOgV4j1u2E,2023-10-07,Prabhavathyreddy Esanakula,Canadians should cooperate with BRICS in investigation of the allegation that canada is permissive of anti indian activities by a section of it's citizens.
btOgV4j1u2E,2023-10-07,Prabhavathyreddy Esanakula,"Criminal is a Criminal. Just by providing a Canadian visa,  Criminal won't get cover."
btOgV4j1u2E,2023-10-07,Ian Faust,"Given Canada's alacrity and sensitivity to India's concerns all these decades Im sure India will treat Canada's concerns with the same level of sensitivity and alacrity.  Canada's relationship with US and others is far less robust than they will believe.   Finally, the USA knows just as well as China or Russia that India does NOT bend to anyone when it comes protecting its national interests."
