videoId,publishedAt,authorDisplayName,textDisplay
ymOjTHcaEaw,2023-11-05,You 2,Cda..rechts van het midden..moet kiezen tussen links of rechts.
ymOjTHcaEaw,2023-11-05,Albert,Vette mottenbal
ymOjTHcaEaw,2023-11-05,Corona Wappie,"Een bezoek aan de huisarts is alleen voor de rijken, want zij gaan allerlei onderzoeken doen , en dat moet je allemaal betalen en wel aan het eind van het jaar! Terwijl je al elke maand betaald! Dus ik ga gewoon niet naar de huisarts!"
ymOjTHcaEaw,2023-11-05,Gemme Burger,Er is al dienstplicht.... een militaire dienst.
ymOjTHcaEaw,2023-11-05,Arnold vd M,Deze bus rijdt in opdracht van provincie Noord-Holland
ymOjTHcaEaw,2023-11-05,Adam Walker,Dirty seconds? Clean would be better but I’ll take dirty.
ymOjTHcaEaw,2023-11-05,Ene Chaos,35:33 hoort ze wat ze zegt? Bedrijven maken winst. ‘Er is nog veel te halen’ het is niet van jou hoor😂 mensen werken er voor. Gek he? Dat alle grote bedrijven zoals shell en unilever uit Nederland weg zijn gegaan… daar gaan je centen!
ymOjTHcaEaw,2023-11-05,Mrfatmanjunior,Ik kreeg sterk het gevoel dat Lillian geen idee hoe het werkt in de vrije huursector...
ymOjTHcaEaw,2023-11-05,HerrFinsternis,Het was zeven
ecfCxfJL6kQ,2023-11-05,Robert Spanjaard,zo snel als mogelijk naar NUL zetels
btOgV4j1u2E,2023-11-05,Nabarun Dey,"Vicent is totally biased. He ovelooks Canada's track record protecting criminals for last 30 years. Freedom of expression is a ear sore to us Indians, which the Canadians play again and again like a broken record."
Q_-wEzLKi7g,2023-11-05,VPN Consult,Complex dat deze CDA'er zich presenteert als t redelijke midden & kritiek heeft op alle partijen om hen heen. Zonder kritisch op eigen extreme beleid van woningmarkt en covid te zijn.
Q_-wEzLKi7g,2023-11-05,Ad van Mook,Bontenbal  Hoekstra heeft heel het c d a  kapot gemaakt
PLAW9h0E5pQ,2023-11-05,Hetiswat,Mijn hemel wat een loze beloftes.
PLAW9h0E5pQ,2023-11-05,Hetiswat,Mijn hemel wat een loze beloftes.
PEXjBXe_WgA,2023-11-05,DFandV,Typisch CDA maar ook niet hun alleen. Dit laten gebeuren en dan wanneer er verkiezingen zijn dat dit moet gebeuren.
ymOjTHcaEaw,2023-11-06,best gameplay,de 4x de huur moeten verdienen is toch logisch anders kan je niet goed de huur betalen door de duren boodschappen etc??? willen mensen gewoon huur van 1800 mogen terwijl ze maar 1900 verdienen ???
ymOjTHcaEaw,2023-11-06,Julia Boehoe,Pleur op met je verplichte dienstplicht CDA😂😂😂 mijn kinderen niet gezien. Zou zeggen geef het goede voorbeeld en begin er maar alvast mee met je halfjaartje😂
PEXjBXe_WgA,2023-11-06,TCHadez,Vlak voor de verkiezingen traditionele gezinnen prijzen terwijl jullie zelf medeverantwoordelijk zijn voor minder nucleaire families?
JkaYpG7zABg,2023-11-06,John Koerts,Zolang we geregeerd worden door oorlog hitsers verandert er niets.
JkaYpG7zABg,2023-11-06,nobody,In een fatsoenlijk land hebben we politici nodig die hun afkeur uitspreken over  ongeprikte mensen die voor de deur van McDonalds werden uitgelachen omdat ze niet naar binnen mochten........
JkaYpG7zABg,2023-11-06,remco nitschelm,..... nieuwe generatie politici???  ... ziet er niet goed uit !!!
JkaYpG7zABg,2023-11-06,DeHemelvlam,"Stem FvD, anders gaat er niks veranderen."
JkaYpG7zABg,2023-11-06,koos ijdema,Stem CDA ;  de partij met het eerlijke verhaal en geen loze beloften!  Stem Bontebal😊
ymOjTHcaEaw,2023-11-07,Ingrid,"Fijne sfeer in deze aflevering, beide met respect! Bontebal klinkt als een aangename persoon en ben benieuwd of die nieuwe CDA cultuur stand houd, eerdere lijsttrekkers van het CDA waren akelige mensen. Marijnissen was sterk en toch luchtig, gun de SP zeker meer zetels dan ze in de peilingen hebben. Het zorgstelsel ombouwen zoals zij aangeeft klinkt erg goed in de oren (zeg ik als iemand die niét chronisch ziek is) maar misschien dat een epxlainer (vanuit de SP?) om dat onderwerp verder toe te lichten en uit te leggen wel op zijn plaats is, ik kan mij voorstellen dat dat een plan is dat meerdere kabinetten duurt etc."
ymOjTHcaEaw,2023-11-07,Daniël G,Het is toch absurd dat bedrijven en vermogenden amper belasting betalen? We kunnen daar de armoede en andere grote problemen makkelijk mee oplossen. En iedereens leven verbeteren met een verlaging op arbeid 💪. Echt SP voor mij!
ymOjTHcaEaw,2023-11-07,Yogini Love,nederland heeft keiharde maatregelen nodig.het word tijd dat we aan onszelf gaan denken en niet constant onszelf kapot werken voor een ander!!
ymOjTHcaEaw,2023-11-07,lois1616,Eerlijk waar... Kunnen we het jongvolwassenen noemen ipv jongeren? 😅 Ik vind namelijk iemand van 30 geen jongere meer.
ymOjTHcaEaw,2023-11-07,Jeffafa,"Eerlijk gezegd, ik vind dit slappe antwoorden van allebei. Het is positief, maar te nietszeggend. Het stukje over de inkomenseis in de vrije huursector en het stukje over GGZ waren niet eens fatsoenlijke antwoorden op de vragen..."
ymOjTHcaEaw,2023-11-07,brulsmurf,Ballebroek for president
ymOjTHcaEaw,2023-11-07,MartinL L,"Sorry, maar Bontenbal wat ben je wanhopig bezig, zielig maar jou partij stopt binnenkort met bestaan door al die verkeerde keuzes."
btOgV4j1u2E,2023-11-07,Elliot Alderson,"Vincent is typical Donkey expert 🐴.. My simple question to these Donkey expert is ""Will Canda be okay if India starts aiding and abetting militant insurance in Canada""? Bcz that's what Canada is doing inside India."
acZ8_0QafxI,2023-11-07,Lucas Van gent,Versta er geen kut van
LvOLxTztVmw,2023-11-07,Robin Elise,"Waren die bij 't CDA weggelopen mensen van 't CDA ? ...Daar zal de fout zitten !  Het CDA was nooit van, voor en door de mensen, maar net als een kerk die beweert dan men alleen met God via de kerk kan zijn."
LvOLxTztVmw,2023-11-07,Sander Oosterling,Ja ze hebben omzigt niet binnenboord kunnen houden. En nu is het huilie huilie.
LvOLxTztVmw,2023-11-07,Arthur de Vrome,Ik zie het CDA wel verdubbelen! Van 1 naar 2 zetels!
LvOLxTztVmw,2023-11-07,kuko maan,En die zitten nu bij bbb en nsc! Dus oude wijn in nieuwe zakken.
LvOLxTztVmw,2023-11-07,Shaffy Scholts,"Klasse van Bontebal, mijn stem heeft hij! Groene economie for the win!"
LvOLxTztVmw,2023-11-07,Jeroen,Het gedrag van Hugo de Jonge heeft de kiezer weg laten lopen bij het CDA. Ik heb 4 jaar geleden van Haga Buma gekozen en zal door Hugo nooit meer op het CDA gaan kiezen.
LvOLxTztVmw,2023-11-07,Polder,Bontebal….. Bla bla bla WIJ GAAN KNALLEN😂😂😂😂😂😂
LvOLxTztVmw,2023-11-07,View of Today,Wat een bla bla bla bla
LCQxQEv3LF0,2023-11-07,Darth Opinion,Bontenbal oprecht een van de meest geïnspireerde en ideologische lijsttrekkers deze campagne. Hoop dat het hem lukt een goed resultaat neer te zetten.
LCQxQEv3LF0,2023-11-07,koos ijdema,Zeker een prima gozer!  Geloofwaardig
LCQxQEv3LF0,2023-11-07,Jeroen,was leuk.. symphatieke kerel die henri
JkaYpG7zABg,2023-11-07,khatira Naubahar,Als jullie willen meer woning bouwen in de toekomst in de Nederland dan hou rekening met mensen die minder geld in bughet hebben. Maak woningen die tenminste voldoet aan de basis behoefte van mensen die minder geld besteden te hebben of door hun beperking in ziektewet zijn.
JkaYpG7zABg,2023-11-07,Bastiaan Stapelberg,CDA wil de WW afschaffen en waarom wil het CDA dit doen??
8F1q6j0KV2o,2023-11-07,PixelPhobiac,Wat is er precies verkeerd aan buitenlandse studenten? Volgens mij is het alleen maar goed als we zo veel mogelijk brainpower cultiveren hier in onze kenniseconomie
8F1q6j0KV2o,2023-11-07,Jo Jong,Aan deze tafel is Wilders de enige die het beste met Nederland voor heeft.
8F1q6j0KV2o,2023-11-07,studio omega,"We hebben die arbeidmigranten juist nodig om die 390.000 woningen te bouwen, Geert. En verplegend personeel om de veroudering op te vangen. En hoogopgeleiden om hi-tec Nederland in stand te houden."
8F1q6j0KV2o,2023-11-07,John Boy,Wilders heeft gelijk 👍
8F1q6j0KV2o,2023-11-07,Pro Libertate,Ik vraag me af of de VVD (stemmer) wel echt iets aan de instroom wil doen. Als dat zo was hadden we toch allang ander beleid?
8F1q6j0KV2o,2023-11-07,Irene Sangster,Vorige kabinet was crimineel en moet zich verantwoorden
8F1q6j0KV2o,2023-11-07,Joke Hagemans,Goed gesproken  geert  weg met vvd
8F1q6j0KV2o,2023-11-07,68co,"😂 alleen een stem op fvd laat iets veranderen, alle andere partijen voeren het beleid uit Brussel uit. Dus allen ga lekker stemmen, maakt toch niet uit waar je op stemt"
8F1q6j0KV2o,2023-11-07,PriveShow,08:03 Trut. Dus kleine bedrijven en ondernemers gaan kapot doordat gelukzoekers hier hun handje ophouden en massaal alles krijgen? Uitkeringen trekken? Totaal gebrek aan logica.
8F1q6j0KV2o,2023-11-07,Mat Br,Mijn stem gaat naar Geertje
8F1q6j0KV2o,2023-11-07,Frank vanderK,hoeveel mensen kunnen er bij Bontenbal in huis koemn wonen?
8F1q6j0KV2o,2023-11-07,Ton Jansen Art Studio,"Bontenbal draait de bandrecorder maar weer een keer af,Muts."
8F1q6j0KV2o,2023-11-07,Andrew R.,Hoe gaan VVD en PVV samenwerken als ze zo al praten tegen elkaar? 😂
8F1q6j0KV2o,2023-11-07,Bastiaan Stapelberg,😂😂😂 Nee de VVD brengt Nederland vooruit 😂😂😂
8F1q6j0KV2o,2023-11-07,Erik Rommerts,"Ga allemaal nou eens werken volgens de juiste volgorde. Je gaat ook niet eerst behangen en dan metselen. Bepaal op welk moment in de tijd hoeveel mensen nodig zijn in de samenleving. Dan ff rekenen (geboorte, sterfte, etc) en maak dan een plan hoe je dat aantal gaat bereiken. Pffffff."
8F1q6j0KV2o,2023-11-07,H M,Het CDA had de stekker eruit moeten trekken mooie slappeling.
8F1q6j0KV2o,2023-11-07,Hans H,"Hij is niet jou land, Turkije is jou land . Hier ben jij te gast"
8F1q6j0KV2o,2023-11-07,Henk Brama,Rutte zou anders zijn toekomstige baanje aan zijn neus voorbij zien gaan niets anders dan dat.
8F1q6j0KV2o,2023-11-07,VPN Consult,Kan Niet - Wil Niet.
8F1q6j0KV2o,2023-11-07,Axq,"Geen relocatie, maar deportatie."
8F1q6j0KV2o,2023-11-07,TheReincarnatedDeath,VD Burg werkt zich het zweet in de naad voor de spreidingswet.
8F1q6j0KV2o,2023-11-07,T.O.§.A,"liegen,liegen,liegen"
8F1q6j0KV2o,2023-11-07,Xiomara Quauro,Oh oh de langstzittende Kamerlid met zijn handen in zijn zakken langs de zijlijn staan Zal je laten zie wat is aan de zijlijn staan 😂
8F1q6j0KV2o,2023-11-07,Joke Hagemans,Ik moet  haar niet  van vvd
8F1q6j0KV2o,2023-11-07,L V,Stem FVD
8F1q6j0KV2o,2023-11-07,Jmj Rademakers,FVD.
8F1q6j0KV2o,2023-11-07,Belinda Kruger,FVD 100%
ymOjTHcaEaw,2023-11-08,marinus18,Ik denk dat we het Duitse huur systeem kunnen overnemen waar ze huren voor oude huizen vast zetten als die huizen hun waarde behouden en dat ze strenge eisen hebben voor de kwaliteit van gebouwen. Het alleen hebben voor oude huizen zorgt ervoor dat er heel veel nieuwe huizen worden gemaakt omdat je daar meer voor kan vragen maar omdat de oude huizen er nog steeds zijn blijft de huur redelijk laag. Om de zoveel tijd kun je de wet vernieuwen en alle huizen die er dan gebouwd zijn de huren beperken.  Hoge bouw standaarden hebben en ervoor zorgen dat die worden nageleefd is heel belangrijk. In New York probeerde ze dat zonder en het was een harde mislukking.
btOgV4j1u2E,2023-11-08,Sagar Agarwal,If Canada Chooses to go public then pls submit the proof publicly too! Dont ask for private talks!
MkFV9eoYchM,2023-11-08,Jan Dijk v,"EFEZIËRS 6  12Want we strijden niet tegen mensen, maar tegen de onzichtbare leiders, machten en heersers van deze donkere wereld. Dus tegen de duivelse geesten in de geestelijke wereld."
LvOLxTztVmw,2023-11-08,MC1024,"Lol, we hebben nu CDA 1.0, CDA 2.0 en CDA 3.0. Die mensen hebben voornamelijk ruzie met zichzelf."
LCQxQEv3LF0,2023-11-08,Lucas 11,"Eigenlijk is deze man leuker dan balkenende, Buma en Hoekstra. En dan toch totaal afgestraft worden door het electoraat"
LCQxQEv3LF0,2023-11-08,Titanium Aura,"Hele mooie horizon, bedankt voor de video."
LCQxQEv3LF0,2023-11-08,Paul T,Goed dat de C weer aandacht en inhoud krijgt
C-SkOUO3BOg,2023-11-08,Jan Stevens,"Geert, mijn stem heb je. 👍👍👍"
8F1q6j0KV2o,2023-11-08,Alpestra,Bontenbal was hier zeker het sterkst
8F1q6j0KV2o,2023-11-08,jan ludwig,Grenzen dicht Nederland is de baas over hun eigen grens
8F1q6j0KV2o,2023-11-08,Truus Jenskens,"Dankzij de VVD hebben we nu 1.3 miljoen vluchtelingen in ons land waar we geen huizen/geld voor hebben...en de politie is ook zwaar overbelast geraakt. Bij ons in de stad hoor je alleen nog buitenlandse talen op straat, vooral ukrains."
8F1q6j0KV2o,2023-11-08,Pat van G,Rutte (VVD) haalde 1 miljoen Moslims en Afrikanen naar Nederland.. En elk jaar 100k erbij.. Einde NL 🇳🇱
8F1q6j0KV2o,2023-11-08,Fewijuce,Wilders altijd gelijk.
8F1q6j0KV2o,2023-11-08,Robert,"Het kan wél, want andere Europese landen doen het ook."
8F1q6j0KV2o,2023-11-08,huub smeets,"van noord naar zuid met de bezem erdoor en iedereen die hier niet thuishoort op de boot/vliegtuig naar of zo dicht mogelijk naar huis sturen/brengen en daar ""loslaten"""
8F1q6j0KV2o,2023-11-08,Liza,tot november geert je wordt de grootste
8F1q6j0KV2o,2023-11-08,Ma,Liever gelukzoekers met een mismatchende cultuur het land inhelpen dan mensen die Ons land kunnen helpen weer wel- en voortvarend te worden? 🧐🤔
8F1q6j0KV2o,2023-11-08,Mauro,kan dat wijf die mensen eens uit laten praten jezus zeg
8F1q6j0KV2o,2023-11-08,John Smid,Dus weer geen VVD stemmen....
8F1q6j0KV2o,2023-11-08,MrSchotland,Die Bontenbal😂hij zegt het zelf? Die shit!!!!
8F1q6j0KV2o,2023-11-08,Cor vAvW,Cda vvd deze kruiwagen politici wil je toch niet met wilders laten discussiëren 😢na de verkiezingen weet ik wel wat er gebeurd ( niets) of Nederland moet massaal pvv fvd stemmen. Links geleuter of rechts geouwehoer.
8F1q6j0KV2o,2023-11-08,siem 2696,wat kan die turk liegen zeg.
8F1q6j0KV2o,2023-11-08,johnny mematik,Het enige wat me een ruk kan schelen is de WOLF!
ymOjTHcaEaw,2023-11-09,Lisa O,Zit er hierin ook een stukje over migratie? Zoja wanneer?
ymOjTHcaEaw,2023-11-09,Paul Heus,waarom aleen ongeren?
LCQxQEv3LF0,2023-11-09,Christiaan Stevens,Bontenbal voor premier🔥💯
LCQxQEv3LF0,2023-11-09,A Van Harten,Wef puppet wolf in schaapskleren
IEkvCymJeUY,2023-11-09,Twan K,Hoewel ik niet voor de principes sta van het CDA bewonder ik Henri zeker voor het aanpakken van deze rol en zijn kennis en kunde. Desondanks denk ik wel dat het CDA nu enorm in de problemen door fouten van voorgangers waar Henri niks meer aan kan veranderen. Die schade is helaas al geschied.
IEkvCymJeUY,2023-11-09,Ben Geurden,Die twee gasten denken dat een partij het hele beleid kan bepalen en als er dan niets gebeurt zoals ze het willen dan zeggen ze hun lidmaatschap op. Alsof het CDA 123 alles gaat veranderen in een paar jaar tijd.. Wel respect voor Bontenbal dat hij zo om kan gaan met dit soort simpele mensen. En dan ook nog zo'n journalist die compleet ongenuanceerd zit door te drammen.
IEkvCymJeUY,2023-11-09,koos ijdema,Mijn complimenten richting de heer Bontenbal dat hij het aandurft het CDA weer op de rails te krijgen!!
IEkvCymJeUY,2023-11-09,RotteAppel,"Henri komt over als een enorm sympathieke en realistische man. Mijn standpunten matchen meer met de VVD, maar heb CDA zeker als #2 staan"
IEkvCymJeUY,2023-11-09,Maurits Bol,Ik denk dat we alvast kunnen gaan zwaaien naar t CDA. Vooral omdat ze waarschijnlijk een aantal zetels halen dat op één hand te tellen is.
IEkvCymJeUY,2023-11-09,HackingDutchman,"Als de boeren niet meer op het CDA willen stemmen, wie dan wel?  Tevens komt deze lijsttrekker niet echt als een leider en daadkrachtig over, al helemaal niet vergeleken met de andere partijen. CDA zal wel opgeheven worden na de komende verkiezingen als ik dit zo hoor en zie."
IEkvCymJeUY,2023-11-09,Brian Jacobs,"“We hebben een wooncrisis, gascrisis, we hebben de afghaanse vluchtelingen” afghaanse vluchtelingen????"
IEkvCymJeUY,2023-11-09,B,Alleen in de negative zin
IEkvCymJeUY,2023-11-09,lijenamacka,Denk steeds dat het een typetje van Diederik Ebbinge is.
IEkvCymJeUY,2023-11-09,Harry,Een interessante Video
IEkvCymJeUY,2023-11-09,Ben Dijkhuis,"Het viel mij op dat hij veel in wollige taal vertelt, maar weinig zegt.😉"
IEkvCymJeUY,2023-11-09,Guido,Gelul in de leegte
IEkvCymJeUY,2023-11-09,Matthijs Veldkamp,"Met alle respect, maar ik hoor vooral een hoop onzeker gestotter en dan ook nog vragen en hopen dat de kiezer alstublieft het CDA nog een kans wil geven. Het CDA speelt al heel lang niet meer mee."
IEkvCymJeUY,2023-11-09,sarah Chetverikov,Ik wil zo graag op Hugo de Jongen stemmen. Waarom is ie niet verkiesbaar? 😭
IEkvCymJeUY,2023-11-09,Bastiaan Stapelberg,CDA wil de WW afschaffen
IEkvCymJeUY,2023-11-09,Caskraker,"Geen boeren meer, geen fundamentalistische gelovigen meer. Geen Limburgers meer, allang geen Brabanders. Wie hou je dan nog over? Vijf zetels is nog teveel."
IEkvCymJeUY,2023-11-09,GNV International Ambassador,ophouden met onderbreken
IEkvCymJeUY,2023-11-09,Sergeant_MajorGross,Antwoord: nee
IEkvCymJeUY,2023-11-09,,Is dit Jiskefet?
IEkvCymJeUY,2023-11-09,Etienne231,Wopke 2.0
IEkvCymJeUY,2023-11-09,Adriaan Bert de Velde Harsenhorst,Huichelarij 🤡👾😈🔥
IEkvCymJeUY,2023-11-09,To,ik kann m niet serieus nemen door zijn accent
IEkvCymJeUY,2023-11-09,STOP de chemtrails,Stem dus FvD
C-SkOUO3BOg,2023-11-09,Carla Nieuwenhuijs,Goed gezegd Geert 👍.
8F1q6j0KV2o,2023-11-09,Mar.Y.Sol27,Ik hoop dat mensen het eindelijk eens begrijpen : de enige partij die iets kan betekenen voor Nederland is : de PVV of FVD.Punt
8F1q6j0KV2o,2023-11-09,Jaap Roos,"Over honderd jaar zij er documentaires  op Discovery over hoe een land, cultuur en civielisatie is ondergegaan en hoe jammer dat ook is. Nederland onderdeel van geschiedenisboekjes."
8F1q6j0KV2o,2023-11-09,lange,Wilders is de baas en de pvv moet meedoen
8F1q6j0KV2o,2023-11-09,Patrick,Ach al die partijen weer mooie woorden en uiteindelijk vormen ze een coalitie die ze uitkomt en gebeurd er weer niets. Wat een theater is dit
8F1q6j0KV2o,2023-11-09,Pat van G,"Google ""hoeveel migranten Nederland 2010""en daarna"" hoeveel migranten 2022"" en huiver.. Einde NL 🇳🇱"
8F1q6j0KV2o,2023-11-09,Bertus Horstman,"Yesilgoz zei hier dat er teveel mensen naar ons land komen ,maar het is haar land niet zij komt uit Turkije.zo iemand hoort niet in de nederlandse politiek heb je ooit een Nederlander in de Turkse politiek gezien  ik niet dus oprotten"
8F1q6j0KV2o,2023-11-09,robert merk,"Ze is egt heel goed ze maakt punten, als ik niet zo teleurgesteld ben in de afgelopen 12jaar door steeds maar voorgelogen te worden door de vvd had ik o de vvd gestemt  maar deze keer trap ik er niet in."
8F1q6j0KV2o,2023-11-09,ja jaed,ha ha ha. NPO. Daar kijken we niet naar.  Vreselijk deze omroepen. 😅
ymOjTHcaEaw,2023-11-10,Rosegold Beats,nooit van mijn leven ga ik dienstplicht in
ymOjTHcaEaw,2023-11-10,jan minderman,Gewoon 400 000 terug naar huis.
ymOjTHcaEaw,2023-11-10,Rick,"Geen wonder dat dit maar 58k views heeft... Wat een belabberde antwoorden. Geen wonder dat de SP zo gekelderd is de afgelopen verkiezingen. En het CDA... tsja, einde verhaal."
ymOjTHcaEaw,2023-11-10,AF93,Die Marijnissen he...
acZ8_0QafxI,2023-11-10,Rechtvaardigheid,Liegen om zieltjes te winnen  als je niet stopt met  vluchtelingen instroom kan je geen verantwoordelijkheid nemen  en ook geen verschil maken   met 120.000 woningen bouwen creëren je een stad zoals Eindhoven je haalt 50.000 vluchtelingen binnen per jaar er is een woning te kort van 400.000  Je kan maar 75.000 duizenden woningen bouwen een halve stad maximaal per jaar Waar ga je die bouwen?  Via de milieuwetgeving heb je niet eens de mogelijkheid om in Nederland  de vergunning te verschaffen voor 30.000 woningen te bouwen  Dus 50.000 vluchtelingen zijn 20.000 woningen per jaar  Hoe je 10.000 woningen over dat gedeeld door 400.000 is 40jaar verder  Want het bestaande wachtlijst is 11 jaar  Maar de instroom stopt niet de persoon krijgt ook nog hereniging recht dus 50.000 wordt 150.000 minimaal  Lopen we een tekort op van minimaal 100.000 per jaar  Dus volgend jaar hebben we 500.000 woningen te kort dat is jullie bekend  Daarom de slechte zorg op oudere dan leggen die eerder het loodje  We snappen het wel  Vluchtelingen gaan Voor de oudere
Rr15Ts6Nd-c,2023-11-10,Bep Wolters,"Ik vind het standpunt van het CDA t.a.v. het gezin wel erg luchtig. Waai niet met alle winden mee, zou ik zeggen. Man, vrouw, kind. Prima geregeld door de Baas Boven. Groet vanuit Den Haag."
IEkvCymJeUY,2023-11-10,seker meker,Ze gaan allemaal 1 voor 1 neer. Ben benieuwd wie de winnaar zal zijn. Je ziet gwn dat ze tot nu toe of hun eigen belangen dienen of krom zijn en liegen. En als er niks uitkomt uiteindelijk. Is het stemmen het dan wel waard?
IEkvCymJeUY,2023-11-10,Bert Visscher,"Ik bekijk deze video en stel mezelf weer dezelfde vraag. Hoe denkt de NOS het standpunt van de geïnterviewde tot zijn recht te laten komen, terwijl ze de geïnterviewde steeds in de rede vallen?"
IEkvCymJeUY,2023-11-10,FLies,Jammer dat hij een zinkend schip wilt redden…  Henri opzich lijkt me een toffe politicus met een visie.. Voor het CDA helaas te laat.
IEkvCymJeUY,2023-11-10,Santono,"Nee, Henri is niet zo snugger"
8F1q6j0KV2o,2023-11-10,Bram Smeets,"Moed zakt me oprecht in de schoenen als ik een Turkse VVD partijvoorzitter hoor spreken die het niet eens is met Wilders. Wat denkt ze wel niet. Ik bid tot God dat Wilders premier wordt en dat ik m’n kinderen in een Nederlands Nederland kan opvoeden zonder overal Afrikanen. Afrika=Afrika, Nederland=Nederland."
8F1q6j0KV2o,2023-11-10,Mes rine,Toen Dilan nog bij Pwnd zat nam ik haar nog serieus. Nu ze de politieke ambitie heeft om premier te worden is het maar een genuanceerd trutje geworden die vertaald wat de VVD vindt. We krijgen straks weer een onkundig kabinet en gaan weer lekker over tot de orde van de dag. Ik schaam me ervoor dat wij in Nederland geen moeilijke keuzes durven te maken.
8F1q6j0KV2o,2023-11-10,Ravioli Macaroni,"Wat ik niet snap van immigratie, we hebben ruk werk dat Nederlanders niet willen doen, we geven dat aan de immigranten, vervolgens krijgen ze een kind hier, en verwacht de politiek dan dat ze de kinderen ook dat ruk werk willen laten doen?"
8F1q6j0KV2o,2023-11-10,jaap oost,"Het enige wat het oplost is uit het verdrag stappen. Degene die zeggen dat het zonder dat kan liegen, want mede door het europees hof gaat anders niemand terug. Dus uit het verdrag of rip nederland."
8F1q6j0KV2o,2023-11-10,HODLYOURPAWS TOTHEMOON,Doei vvd 😂
8F1q6j0KV2o,2023-11-10,Arthur de Vrome,"Het is al te laat, we zijn Nederland al kwijt. Éen troost: in Engeland, Duitsland, Frankrijk enz is de situatie niet anders!  Ÿesilgôz gaat ons zeker niet redden. Wel de sociale zekerheid afbreken!"
8F1q6j0KV2o,2023-11-10,Kènekè,Jemig wat n oren Dilan 😮😮😮😮😮😂😂😂
ymOjTHcaEaw,2023-11-11,PendelSteven,"25:21 Dit onderscheidt inderdaad Zuid-Zuid-Holland en Zeeland (samen met Noord-Brabant, Zuid-Limburg en het Vlaams gewest) met de rest van Zuid-Holland.             Waar het op de eilanden nog friet(en) is (behale dan in het uiterste oosten van de Zuid-Hollande eilanden), is het ten noorden daarvan patat            Da's helemaal van de zotten is als je je Vlaams kent, want een patat is natuurlijk gewoon een aardappel.             Mais enfin, des patates frites. Et voilà. Toch heb ik altijd gewoond waar het friet is. Dat dan weer wel."
ymOjTHcaEaw,2023-11-11,09lameass,"Ik vind de heer Bontebal het woord ""gewoon"" veel te vaak gebruiken."
8F1q6j0KV2o,2023-11-11,Ayrton senna,Stem PVV op 22 nov. PVV is er voor ons Nederlanders
8F1q6j0KV2o,2023-11-11,Elizabeth de Roock,"Hebben de Nederlanders nou nog niks geleerd  ,zitten we straks nog bet die bende voor vier jaar!"
8F1q6j0KV2o,2023-11-11,hinderikus bos,"Vraag Dylan migratie , waar was onze minister van Justitie toen burgers in ter apel gemolesteerd werden . Jaren wegkijken en nu mooi praten gaat er bij mij niet in"
8F1q6j0KV2o,2023-11-11,Ayrton senna,Bontebal hadden ze PVV niet uit moeten sluiten dan hadden we dit probleem niet gehad
8F1q6j0KV2o,2023-11-11,Yo Co,"Ik ben geen PVV stemmer,  maar waarom weerleg je die dooddoeners als: ""Dat beleid kan niet worden uitgevoerd,"" niet met een simpel: ""Leg eens uit waarom niet dan?"" Geert? Er is verder ook geen discussie aan tafel alleen maar verwijten. En Dilan die alles one-liners noemt terwijl ze de een na de andere uitkraamt."
8F1q6j0KV2o,2023-11-11,Robert Vermeer,Wat fijn dat de VVD geen kiezers uitsluit.. (??)
42Cx2A4XL9w,2023-11-11,Paul Van Amersfoort,Aardige slimme man. Verkeerde partij...
42Cx2A4XL9w,2023-11-11,Aart Sipman,Geen enkele kennis van zaken
Q_-wEzLKi7g,2023-11-12,Antoine Roccamora,"Vond het vooral een Vaag Gesprek, Doorgeschoten Marktwerking willen aanpakken bij de zorg en wonen maar niet precies aangeven hoe? Zou dus goed zijn op bepaalde onderwerpen experts aan tafel te zetten met een paar gerichte vragen"
N6lfijtbbQs,2023-11-12,bollewillem1,"0:00 ‘Dag meneer’ hahahaha, geweldig."
N6lfijtbbQs,2023-11-12,Arthur de Vrome,kleine broertje van de ChristenUnie! 🤣🤣🤣
N6lfijtbbQs,2023-11-12,Jouke Mellema,erg grappig
N6lfijtbbQs,2023-11-12,VPN Consult,Toch gek dat ze in de partij nog steeds geen afstand hebben genomen van Hugo de Jonge.
N6lfijtbbQs,2023-11-12,Nb,Geestig
IEkvCymJeUY,2023-11-12,Gerard Vriend,Ik heb het CDA al in 1995 verlaten. Nooit spijt van gehad. Ze moesten zonodig de groenteveilingen opdoeken en daarmee nagenoeg alle aangesloten bedrijven!
IEkvCymJeUY,2023-11-12,Iamme Heretobeme,"Hij lijkt me een oprecht persoon met zijn hart op de juiste plek. Dat ken ik niet van cda. Ook niet van nsc, bbb, vvd, d66, groenlinks  maar ik verwacht niet veel van 1 persoon."
IEkvCymJeUY,2023-11-12,Gerard Vriend,Henry verteld eigenlijk niks. Precies het verhaal van het CDA.
8F1q6j0KV2o,2023-11-12,Anonymous1989,Als je een totale lock down kan invoeren en handhaven dan geloof ik ook wel dat het mogelijk is om de grenzen zo goed als mogelijk voor imigranten te sluiten. Het zal inderdaad wel financieel wat kosten maar je kan geen prijskaartje aan de veiligheid van het land inclusief onze normen en waarden hangen. Het is de basis en van daaruit bouwen we verder.
