videoId,publishedAt,authorDisplayName,textDisplay
bN2XUUv1uvo,2023-07-07,G.A. Van Amstel,"CDA kan beter helemaal stoppen. Laat Omtzigt met Mona een nieuwe partij oprichten, dan kunnen ze veel zetels halen. Liefst met Renske erbij"
bN2XUUv1uvo,2023-07-07,Karel de Kale,Wopke Hoekstra?Wat een gotspe!
bN2XUUv1uvo,2023-07-07,J Buitendam,Het kabinet gaat niet vallen een narcisten gaat niet uit zich zelf weg
bN2XUUv1uvo,2023-07-07,truus marja,Mona Keizer terug in de politiek!!
bN2XUUv1uvo,2023-07-07,Jon Hagedoorn,M.I.L.F Keijzer.
bN2XUUv1uvo,2023-07-07,William de Wit,PRIKSCHADE.
bN2XUUv1uvo,2023-07-07,Gerard Hensen,hoekstra verrader
bN2XUUv1uvo,2023-07-07,Flying Dutchman 17,CDA = NSB
bN2XUUv1uvo,2023-07-08,jo bovens,Wouther met zijn gay mondje
bN2XUUv1uvo,2023-07-09,Norma,Jammer dat je weer terug bent in het hol van de leeuw
8T7jMVSsSr4,2023-07-09,Van de Berg,Hij wordt gewoon weer leerkracht! 🎉
8T7jMVSsSr4,2023-07-09,Akkie Kiggen,"Als je het cda naar de filistijnen wil helpen, moet je Hugo de jonge kiezen 😂😅🤣"
8T7jMVSsSr4,2023-07-09,Patrick Grinwis,Hugo liegt en bedriegt nog steeds.
8T7jMVSsSr4,2023-07-09,Barry van der Meer,"Da's mooi! Hopelijk zijn we dan eindelijk ook van hem af. Maar eerst zien, dan geloven"
8T7jMVSsSr4,2023-07-09,tony mctony,Als je je het Cda helemaal kapot wil maken laat hem dan lijsttrekker worden
8T7jMVSsSr4,2023-07-09,Mark Overwater,Kan Hugo eindelijk zijn droombaan schoenenverkoper nastreven
8T7jMVSsSr4,2023-07-09,computerbugie F.,"vraag aan Hugo de Jonge: wat is je lieveling kleur?    antwoord: Nou nou!, het betreft namelijk niet het gehalte aan kaas en frikandellen in de soep die men met timmeren met gereedschapskist op school in de tussen uren van de belastingdienst kan vragen op een dinsdag dit weekend bij volle maan in de regen...maar alleen bij Sinterklaas tussen de postNL pakjes van afgelopen zondag met een toename van 11 liter bij verkoop van 1 kilo...dus vaccineren is en blijft  noodzaak om al deze redenen."
8T7jMVSsSr4,2023-07-09,nobody,Logisch ook als je frikandellen gaat vergelijken met vaccins
8T7jMVSsSr4,2023-07-09,Rolf Prejean,"haha, Hugo, serieus?  over 3 maanden weten we meer. Huug heeft eerder al eens uitspraken gedaan, die laten toch niet zo waar bleken te zijn..."
8T7jMVSsSr4,2023-07-09,Patrick Andeweg,Ook hugootje moet getribunaliseerd
8T7jMVSsSr4,2023-07-09,Jan,Die Hugo is niet meer aan te zien en te horen. Verschrikkelijk.
8T7jMVSsSr4,2023-07-09,Lex Veen,"Ga maar een baan zoeken die bij je past. Onderaan beginnen, net zoals iedereen 😂"
8T7jMVSsSr4,2023-07-09,Some day,Griezel!!!!!!
8T7jMVSsSr4,2023-07-09,GertJan van der Kooij,Kan maar beter schoenverkoper worden
8T7jMVSsSr4,2023-07-09,Michel van de Pol,dit is heel goed nieuws we zijn van de griezel af?
8T7jMVSsSr4,2023-07-09,Edwin Brouwer,"Deur voor deur, arm voor arm."
8T7jMVSsSr4,2023-07-09,Randy Marsh,Hugo de Jonge hoort in de gevangenis te zitten
8T7jMVSsSr4,2023-07-09,Cor Velleman,We weten waar ze wonen
8T7jMVSsSr4,2023-07-09,Chris Bachofner,Op geruimd staat netjes.
8T7jMVSsSr4,2023-07-09,Galaxy Galaxy,Als ik goed geluisterd heb wordt hij lijsttrekker😅
8T7jMVSsSr4,2023-07-09,JMM short channel,Hij denkt wel vaker wat die hugo. Een tribunaal zou beter passen. Leugenaar
8T7jMVSsSr4,2023-07-09,mensen zijn van mensen,Media zien hem wel zitten. Dus hij wordt het@ Dancawhit jansan
8T7jMVSsSr4,2023-07-09,2304lb,Hugo moet je opsluiten
8T7jMVSsSr4,2023-07-09,jos zoet,Pieter wordt lijsttrekker..! Maar niet van het CDA !
8T7jMVSsSr4,2023-07-09,Paul Van Amersfoort,Is ook niet nodig.  CDA bestaat na de verkiezingen niet meer..hahahahaha 😂😂😂
8T7jMVSsSr4,2023-07-09,sylvester pulk,"die ogen van hugo spreken weer boekdelen ,,speed,, junky"
bN2XUUv1uvo,2023-07-10,John Mckinney.,"Nobody cares wat Mona vindt van wat dan ook, en al helemaal niet wie de lijsttrekker van het CDA wordt"
bN2XUUv1uvo,2023-07-10,Dorus ,Mona is top
bN2XUUv1uvo,2023-07-10,Guy Renardeau,Mona Keijzer natuurlijk want die hebben ze indertijd weggepest omdat Mona eerlijk en oprecht is.
8T7jMVSsSr4,2023-07-10,B van der V,Hij hoort in de gevangenis.
8T7jMVSsSr4,2023-07-11,Camiel van Lenteren,"GODZIJDANK, deze man verdient pek en veren."
8T7jMVSsSr4,2023-07-11,harrie houtman,"Om te beginnen, een parlementair diepgaand onderzoek naar deze meneer, lijkt me het minste."
8T7jMVSsSr4,2023-07-11, Den Bogert,Gelukkig bestaat het cda. Na de verkiezingen nier meer.😊😊😊
8T7jMVSsSr4,2023-07-11,Gerald DeBerg,"Hugo komt beter uit de verf als clown, hij heeft zijn schoenen al..."
8T7jMVSsSr4,2023-07-11,lexpee,"opgerot staat netjes, hub weer terug naar de klas."
8T7jMVSsSr4,2023-07-11,Roosjes,"Waar is die 5,5 miljard ,"
jla-UbFIx4M,2023-07-12,Nina Camer,Echt knap van Omtzigt dat hij niet in te pakken is en dat hij in onze afgestorven politiek zoveel aanhangers en vertrouwen heeft in het land
jla-UbFIx4M,2023-07-12,Allemaalpannenkoeken,Als Omtzigt dit gaat doen is hij ook zijn  geloofwaardigheid kwijt!
jla-UbFIx4M,2023-07-12,IsoleerBeer,Pieter moet nooit meer terug gaan naar het CDA! Ze hebben hem verraden.
jla-UbFIx4M,2023-07-12,Herman Lighaam,"Als het CDA Omtzigt zo hard nodig heeft hadden ze vierkant achter hem moeten gaan staan bij de toeslagenaffaire, maar toen lieten ze hem vallen als een baksteen. Sterker nog: na de val van Rutte 3 sloten ze zich weer aan bij de zelfde groep farizeeërs. Omtzigt zou wel gek zijn om terug te gaan naar het CDA."
jla-UbFIx4M,2023-07-12,Max Christoffel,There can only be one: Pieter Omzigt. Lets rumble!
jla-UbFIx4M,2023-07-12,Gait N,"Het CDA heeft lekker ijverig meegesloopt, klaarblijkelijk nu al vergeten!"
jla-UbFIx4M,2023-07-12,E Vitoonbundit,Omtzigt kan vel beter een eigen partij oprichten en dan pas overwegen een enkele CDA-er zoals Mona Keizer overnemen.
jla-UbFIx4M,2023-07-12,yo,Een begeerlijke leider❤❤❤
jla-UbFIx4M,2023-07-12,Digital Love Amsterdam,VVD gaat gewoon door …  Yesilgoz gaat gewoon Rutte overnemen met het zelfde beleid… Man of vrouw maakt in dit geval echt geen verschil… Het wordt VVD met nog een partij… en dan de kleine beetjes…
jla-UbFIx4M,2023-07-12,Tuk Tuk,"Het CDA needs one man, THE man!           SJOERD SJOERDSMA! ❤  Transferprijs van SS7: 135 miljoen"
jla-UbFIx4M,2023-07-12,Michiel wil,Rip de laatste CDA stemmers
jla-UbFIx4M,2023-07-12,Eric Van den oord,"Na alles wat er is gebeurd, Pieter niet toen."
jla-UbFIx4M,2023-07-12,Hessel,"Ze lieten Omtzigt eerst vallen terwijl hij goed was voor heel erg veel stemmen voor het CDA  , nog sterker ze staken hem een dolk in zijn rug , en kotsten hem hoogmoedig en openlijk uit ! Ik denk dat het CDA ook wel weet dat , nu het slecht gaat met de partij , ze ook niet schijnheilig met hangende pootjes bij hem hoeven aan te komen en vragen om zijn hulp !? Het zou me ook niks verbazen (en ik zou het hem zeker gunnen ) als hij in zijn eentje net zo veel stemmen weet te krijgen als het hele CDA ! En ik denk ook niet dat hij zo gek is om zich 2x aan de zelfde steen te stoten !"
jla-UbFIx4M,2023-07-12,Internet Muppet,CDA'ers kunnen zich bij team Omtzigt aansluiten.
jla-UbFIx4M,2023-07-12,jantrammelant,CDA is op sterven na dood. 😂😂😂😂
jla-UbFIx4M,2023-07-12,Nico Hakvoort,Lucille Werner is een mooi voorbeeld van een politieke zakkenvullende Praatpop.
jla-UbFIx4M,2023-07-12,D.N.A.23,Wat een slapende mensen allemaal 😂😂😂
jla-UbFIx4M,2023-07-12,Max Christoffel,Oeps...tikfout: There can only be one: Pieter Omtzigt. Lets rumble!
jla-UbFIx4M,2023-07-12,J. E,Omtziiiggt!!
jla-UbFIx4M,2023-07-12,Herman Mik,Landveraad fucking functie elders
jla-UbFIx4M,2023-07-12,tmh15,Was Tubbergen te ver?😂
jla-UbFIx4M,2023-07-12,Herman R Schippers,Cda = out! Lucille😂 4 lingo
jla-UbFIx4M,2023-07-12,willy schobben,waarom is hugo de jonge nog niet opgeknoopt eigenlijk?
jla-UbFIx4M,2023-07-12,Jop marli,"Is Dirk-Jan Omtzigt  "" WEF medewerker bij papa Schwab "" ook bij betrokken?"
jla-UbFIx4M,2023-07-12,Arjen van Doorne,De Christelijk democratische appel.
jla-UbFIx4M,2023-07-12,VPN Consult,Zou mooi zijn
jla-UbFIx4M,2023-07-12,Eelco,Ik vind Omtzigt een enorme moraal ridder. Besteed de meeste tijd om te vertellen wat anderen allemaal fout doen. Ga er dan niet zitten denk ik wel eens. Als vegetariër ga ik ook niet bij een slager werken om daarna te vertellen hoe enorm fout ze bezig zijn.
jla-UbFIx4M,2023-07-12,Maurice from Netherlands,Partij van de uitsluiting. Vies volk.
jla-UbFIx4M,2023-07-12,Minelab Groningen Pat,Opheffen...draagt niks bij  ..behalve schoothondje spelen.
jla-UbFIx4M,2023-07-12,DFandV,Derk Boswijk of Henri Bontebal
jla-UbFIx4M,2023-07-12,,Donald Trump moet het doen.
jla-UbFIx4M,2023-07-12,Jan B.,"Stem op Boer Koekoek en daar mee uit, hahaha."
jla-UbFIx4M,2023-07-12,Jan B.,Stem op yuppy fietsenboer van moof hahaha.
jla-UbFIx4M,2023-07-12,Jan van der Star,Ik zou nooit op cda stemmen die zyn niet te vertrouwen en achterbaks
bN2XUUv1uvo,2023-07-12,Johan k,Mona sluit je aan bij partij Omtzigt
5AFtAYMJihU,2023-07-12,VPN Consult,"Iedereen die bloed aan z'n handen heeft met betrekking Pieter Omtzigt, zou niet alleen belangrijke functies in de partij moeten verlaten, maar ook fouten moeten erkennen."
5AFtAYMJihU,2023-07-12,Matie Lindhout,Het is goed dat een nieuwe generatie een kans krijgt Daar heeft meneer Heerma gelijk in. Maar ook moeten er mensen met ervaring zijn Soms kun je van ervaringsdeskundige n iets leren.
5AFtAYMJihU,2023-07-12,Sake Boersma,"Heerma, Hermans, Hoekstra, De Jong, Kaag, Paternotte, Sjoerdsma, Jette, Yesilgöz, Kaag… Rutte… etc….. het is toch eens klaar met deze types???"
5AFtAYMJihU,2023-07-12,Henk Zandbergen,"Wie het ook wordt, het cda heeft voor mij afgedaan samen met de vvd en d66 !"
5AFtAYMJihU,2023-07-12,Xp,Huichelaars !
5AFtAYMJihU,2023-07-12,Paul Van Amersfoort,Hahahahaha..CDA bestaat na de verkiezingen niet meer...hahahahaha 😂😂😂
2vcpy99uzXU,2023-07-12,Plra nisch,"succes is geen toeval, hard werken en balans zijn de toverwoorden"
2vcpy99uzXU,2023-07-12,Andre Schenk,"Je kunt natuurlijk een uitgesproken mening hebben Maarten maar de werkelijkheid is soms een beetje anders, lol. Ik luister overigens graag naar je hoor!"
2vcpy99uzXU,2023-07-12,Triple E,CDA zeg je? Is dat niet dat splinter partijtje 🎉
2vcpy99uzXU,2023-07-12,Exarder 1,Maarten die vanuit zijn dure Utrechtse woonwijk maar roept dat wij migranten moeten blijven opnemen is een mooi voorbeeld van hoe ver links van de normale man staat tegenwoordig. Ik zou zeggen ga eens praten met mensen die hier veel overlast van ondervinden of mensen die 20 jaar op een huurwoning mogen wachten.
2vcpy99uzXU,2023-07-12,Herbert van Leeuwen,Wat er niet kan veranderen in 3weken tijd in vaderlandse politiek. Er is geen alternatief! Het alternatief luistert naar de naam Dilan Yesilgoz...😅
2vcpy99uzXU,2023-07-12,Plra nisch,"Alleen een partij die internationaal denkt en lokaal handelt, is te redden"
2vcpy99uzXU,2023-07-12,Bastiaan Stapelberg,Vanaf 1970😂😂..... ik meen mij te herinneren dat in 1890 al behoorlijke problemen waren met het begrip 'zure regen'.
2vcpy99uzXU,2023-07-12,Truth Talk,Ja hoor komt wel goed hoor
2vcpy99uzXU,2023-07-12,Fascisme plus Communisme is Totalitarisme,Het CDA heeft al een doorstart gemaakt met Caroline van der Plas met haar Build Back Better beweging. Het zijn dezelfde streken uit het CDA maar dan in een nieuw jasje.
2vcpy99uzXU,2023-07-12,Sven,"This didn't age well, did it?"
2vcpy99uzXU,2023-07-12,loui1962,"Tjsa ,  daar zit ie volledig naast ."
2vcpy99uzXU,2023-07-12,Piet Hein,Maarten zat er naast.
2vcpy99uzXU,2023-07-12,Frans Schepens,Nee CDA lost op
2vcpy99uzXU,2023-07-12,TEAser,Deel van deze podcast is volgens mij wat ouder of niet dan?
2vcpy99uzXU,2023-07-12,Terry Vogelaar,Voor wie zich afvraagt hoe brandnetels smaken: erg spinazie-achtig.
2vcpy99uzXU,2023-07-12,Frans Schepens,Er is geen klimaatcrisis
2vcpy99uzXU,2023-07-12,Akki,Maarten zei toch dat we Rutte 5 kregen?
jla-UbFIx4M,2023-07-13,Paul Van Amersfoort,Laten we hopen dat Pieter een nieuwe partij opricht.  Dan is het einde verhaal voor de VVD/CDA-maffia !!!❤❤❤
jla-UbFIx4M,2023-07-13,Nelis,"Omtzigt terug bij het CDA? Haha gaat nooit gebeuren, dat zou pas gezichtsverlies zijn zowel voor het CDA als voor Omtzigt zelf."
jla-UbFIx4M,2023-07-13,Beau Fester,Als Pieter Omtzigt kiest voor het CDA - de Christenhonden - dan is mijn geloofwaardigheid in Omtzigt totaal 180 graden gedraaid. CDA is een gepasseerd station oftewel passé !! CDA is out of town and from the countryside!
jla-UbFIx4M,2023-07-13,j groot,CDA het is de partij mij inziens zonder ruggengraat ze hadden Omtzigt nooit moeten laten gaan maar hij kon niet anders
jla-UbFIx4M,2023-07-13,Requiescat,CDA is een gesloten boek zoals Omtzigt zei.
jla-UbFIx4M,2023-07-13,Dory Bleijswijk,"Nou als ie dat gaat doen, dan verliest ie echt mijn respect. Laat Lucille Werner het maar doen. Kunnen we Lingo gaan spelen. Het is zo langzamerhand toch een ballen-kwis geworden."
jla-UbFIx4M,2023-07-13,Zijn in vree - spiritueel advies,Zo'n man die zonder een spier te vertrekken zegt: ik hoop dat CDA en VVD het weer goed gaan doen'. Volgens mij is hij een prototype voor al die anderen die zeggen ikke ikke laat .. Of beseft hij werkelijk niet welk een ongelooflijk leed een deel van de bevolking is aangedaan door deze twee partijen?
jla-UbFIx4M,2023-07-13,Eigenlijk is dat heel logisch,"Omtzigt sluit je aan bij BBB, Omtzigt voor president"
jla-UbFIx4M,2023-07-13,Trix Zijp,Dat klinkt héél goed doordacht... Goed i.h belang v.d Partij..maar zeker niet voor Omzigt..!
jla-UbFIx4M,2023-07-13,Binnenvaart & Transport Nederland,"""CDA-bolwerk snakt naar Omtzig"" Het probleem is dat P O  te weinig een echte christensatanist😈 is😆😆😆"
jla-UbFIx4M,2023-07-13,Truth and Unity,Mona Keijzer en Omtzigt
jla-UbFIx4M,2023-07-13,Christiaan Rozendal,Balkenende dan?
jla-UbFIx4M,2023-07-13,Tutor Ned,Omtzigt moet samengaan met de PVV.....wordt het echt lachen bij de gevestigde orde!
jla-UbFIx4M,2023-07-13,thijsie333,Pff
jla-UbFIx4M,2023-07-13,Ultimate Seduction,"Omtzigt zal zich heus niet laten piepelen door het cda, cda is gelukkig einde oefening."
jla-UbFIx4M,2023-07-13,Marco Van spijk,Pieter
jla-UbFIx4M,2023-07-13,Andre Lejeune,Dom dommer domst
jla-UbFIx4M,2023-07-14,Juroen,2:18 hahaha wat een held. Hier ben ik het 100% met hem eens.
jla-UbFIx4M,2023-07-14,Ayrton senna,"Pieter omzigt , de BBB past 99% bij U, sluit U aan. En premier worden staat u op t lijf geschreven🙏🏼"
jla-UbFIx4M,2023-07-14,Juroen,Als pieter terug gaat naar cda is die in mijn ogen ineens zn geloofwaardigheid kwijt. Cda wil hem alleen terug omdat die zetels gaat scoren.
jla-UbFIx4M,2023-07-14,P Walhout,CDA heeft dhr Omtzigt laten vallen toen hadden ze hem niet nodig en nu wel ?  Dhr Omtzigt moet onze nieuwe premier worden!!! Stem in 2023 op dhr Omtzigt!!!!
jla-UbFIx4M,2023-07-14,R H,Doe het niet Pieter ( dat is dan misbruiken van)....
jla-UbFIx4M,2023-07-14,Peter Taks,"Hop Pieter, naar de BBB! Krijgen we eindelijk nieuw en waarschijnlijk goed beleid in ons land."
jla-UbFIx4M,2023-07-14,coen1504,Maar zien of het CDA de kiesdrempel gaat halen !!
bN2XUUv1uvo,2023-07-14,PutTheEvilOutNL †,FvD stemmen❤
8T7jMVSsSr4,2023-07-14,Jan Kraijer,"Een nieuwe baan bij de mondkapjes industrie is wellicht een goede optie! Minister van Volksgezondheid, daarna minister van Volkshuisvesting, met welke kennis ? De onderwijs sector is geen optie want daar is het al een puinhoop. Als burger van Nederland krijg je de indruk dat kennis van zaken niet nodig is bij sommige partijen van de coalitie. Wanneer je miljarden wilt uitgeven, belasting geld van de burgers, om stikstof te verminderen en burgers van ons Nederland naar de voedselbank mogen dan ben je als kamerlid de weg totaal kwijt. Hopelijk kan er na de verkiezingen een coalitie geformeerd worden die de belangen van ons Nederland behartigen i.p.v. EU en WEF."
8T7jMVSsSr4,2023-07-14,Tom Lochem,Zal iemand op hugo stemmen😅
2vcpy99uzXU,2023-07-14,Rob van iren,"Het lezen van de reacties hier is tijdverspilling, volslagen nullen."
jla-UbFIx4M,2023-07-15,Jones,Wie het ook wordt !  We zitten op gescheept met 😢😢  :  WEF Brussel  Vs   Nederland is reeds verkocht 😢😢😢😢😢😢😢😢😢😢😢😢😢😢😢
bN2XUUv1uvo,2023-07-15,Hans Middelburg,Mona in genade genomen door het cda? Zou ze weten dat ze voor wef werkt? Waarom niet aansluiten bij Omzigt?
8T7jMVSsSr4,2023-07-15,Service Verkoop,wie stemt er dan ooit nog op HUGO MENGELE?
2vcpy99uzXU,2023-07-15,Frans Schepens,Het CDA houdt op te bestaan op een enkele ouwe taart na
jla-UbFIx4M,2023-07-16,Ricky is my uncle,Het is klaar met CDA en daarom wilt niemand naar het front om het te incasseren deze verkiezingen.
jla-UbFIx4M,2023-07-16,Powerstick! Fun,We moeten geen sterke mensen daar hebben wij zijn het volk wij leiden ons zelf wel!!
jla-UbFIx4M,2023-07-17,Fonzie van de Wouw,"EIGEN PARTIJ, en NOOIT geen cda meer Pieter, wij wachten met smart op jouw nieuwe partij !"
jla-UbFIx4M,2023-07-18,Pe Rietveld,"Achgossie, doei CDA"
bN2XUUv1uvo,2023-07-18,Sjoerd Dijkstra,Mirjam Bikker
2vcpy99uzXU,2023-07-18,Aart van Joolingen,en weer heeft van Rossum geen gelijk. hoekstra is nooit voorzitter van de eerste kamer geweest.
jla-UbFIx4M,2023-07-19,JOH TOR,Hoe kan je ooit terug gaan als je zo vernederd ben?
jla-UbFIx4M,2023-07-19,HelloItsMe,2:05 de partijen die vorige landelijke verkiezingen populair waren ja. Waarschijnlijk worden heel andere partijen deze verkiezingen populair
jla-UbFIx4M,2023-07-19,Jeroen Reijers,Als Omtzigt hier in trapt verliest hij 1000 punten.
jla-UbFIx4M,2023-07-19,Elly Heldring,"ik krijg het idee dat omtzich helemaal niet mee gaat doen, de verkiezingen naderen en hij heeft nog niets laten weten."
Tf9LiwT9poY,2023-07-19,Ronald,Omtzigt moet gewoon onafhankelijk blijven en kijken of hij het eventueel langszaam kan uitbouwen met de juiste mensen.
Tf9LiwT9poY,2023-07-19,Leonardo Luc,"Meneer Omtzigt word de grootste partij in NL en Premier, hij is betrouwbaar, werkt hard en kundig."
Tf9LiwT9poY,2023-07-19,Frank Rijs,Het CDA is allang door BBB vervangen alleen beseffen ze dat zich nog niet bij het CDA
Tf9LiwT9poY,2023-07-19,kritisch,prettig gesprek met de dame aan de lijn. eindelijk een politica die zegt waar het op staat.
Tf9LiwT9poY,2023-07-19,Fleurilink International,Als Omtzigt terug gaat naar het CDA dan is hij niet goed in zijn hoofd.   Het terug halen van Omzigt zou alleen voor eigen gewin zijn. Niet omdat ze Omtzigt zo een aardige peer vinden.
Tf9LiwT9poY,2023-07-19,MamaLada,"Als Omtzigt terug zou gaan naar het CDA, dan zou niemand hem meer serieus nemen.."
Tf9LiwT9poY,2023-07-19,John Roekoek,"""Alles op alles gaan zetten."" ""We moeten de schouders eronder vaan zetten."" Door dit soort opmerkingen wordt Sophie Hermans niet voor vol aangezien. Veel geblaat maar weinig wol op de grote onderwerpen."
Tf9LiwT9poY,2023-07-19,R.v.E,tijd voor verandering en even geen CDA meer. duimen dat ze nergens meer te zien zullen zijn.
Tf9LiwT9poY,2023-07-19,J Aangeenbrug,Omtzigt gaat zich denk ik alleen verkiesbaar stellen in zijn provincie. Op deze manier hoeft hij nu geen lijst met 50 leden samenstellen en kan hij met een kleine partij toch de rol welke hij nu heeft voortzetten
Tf9LiwT9poY,2023-07-19,Marcel de Jonge,"Dus BBB zit dan een beetje in het midden en dat is dan ook hun succes. Maar als je Caroline vraagt, ben je links of ben je rechts, dan krijg je geen concreet antwoord? Volgens mij was het midden toch? Waarom zou je willen dat BBB links of rechts is? Daar ligt juist het falen van de andere partijen."
Tf9LiwT9poY,2023-07-19,El Dee,"CDA is toch al klaar, zero fucks given"
Tf9LiwT9poY,2023-07-19,Frank Wiersma,"BBB is inderdaad hetzelfde als CDA, maar dan zonder Rutte."
Tf9LiwT9poY,2023-07-19,Bastiaan Stapelberg,CDA 3 zetels...😂😂 en dan nog zeggen dat Foppe Hoekstra het zo goed deed..halleluja.😂😂
Tf9LiwT9poY,2023-07-19,Strateeg,Ik ben zo blij dat Omtzigt niet bij BBB gaat. Laat duidelijk ziend dat BBB niet integriteit heeft die hij zoekt.  Als hij bij BBB was gegaan was die alle geloofwaardigheid verloren en mijn stem zeker kwijt
Tf9LiwT9poY,2023-07-19,Re Lat,"Nee, natuurlijk niet… meneer Omzigt is belazerd, net als alle stemmers 😢"
Tf9LiwT9poY,2023-07-19,Ad Heijnemans,Pieter zal wel wijzer zijn toch?
Tf9LiwT9poY,2023-07-19,Dwyane3MVP,Wat een vreemd begrip van sociaal conservatisme heeft deze mevrouw (1:08).
Tf9LiwT9poY,2023-07-19,walter vermeer,Omtzigt is te zwak om alleen een partij te beginnen. Een Burnout is een terugkerend gebeuren. Hij moet gewoon bij de BBB gaan.
Tf9LiwT9poY,2023-07-19,robby ilahi,als omtzigt terug gaat naar cda wordt hij een landverader
Tf9LiwT9poY,2023-07-19,connected online,CDA is ziekmakend
Tf9LiwT9poY,2023-07-19,MamaLada,Een brug te ver.....
Tf9LiwT9poY,2023-07-19,Joep,Begin deze man eerst maar eens te beschermen. Ooit was het een doorgezopen wappie die hem lastig vieI op straat maar morgen eentje met een mes of vuurwapen
Tf9LiwT9poY,2023-07-19,behemoth,"Alsof StaIin hij vragen aan Trotski   Swa, jij wil terugkom alsjebelief? Ik ga jou veel doekoe geef"
Tf9LiwT9poY,2023-07-19,Bart Jaja,Ze gaan pas luisteren voor de verkiezingen daarna is het weer de andere kant Tip voor het CDA neem een transgender als lijsttrekker 😂
Tf9LiwT9poY,2023-07-19,Old Cheese,"Ach geloven doe je in de Kerk, en niet in de Politiek. je ziet wat hun Goden aanrichten met hun ogendicht en handjes gevouwen"
Tf9LiwT9poY,2023-07-19,Paul Van Amersfoort,Ach..CDA bestaat na de verkiezingen niet meer..hahahahaha 😂😂😂
KiobMbswvMs,2023-07-19,paul mondeel,"Mark Rutte is te lang blijven zitten, maar Maarten van Rossem mag eeuwig doorratelen."
KiobMbswvMs,2023-07-19,Jos,"De enige kans van overleven voor het CDA, naar mijn mening."
KiobMbswvMs,2023-07-19,debeier,"Niemand vh CDA is voor hem opgekomen of is uit schaamte of protest opgestapt , dus genoeg reden om uit de buurt te blijven vh CDA te blijven."
KiobMbswvMs,2023-07-19,Frans Schepens,Hij zou wel gek zijn om terug naar die Judaspartij te gaan.
KiobMbswvMs,2023-07-19,behemoth,CDA: functie elders
KiobMbswvMs,2023-07-19,R U,Arib is al vertrokken nadat er karaktermoord heeft plaatsgevonden. Om in de termen van Maarten te blijven spreken haha
KiobMbswvMs,2023-07-19,Hester van Rooyen,Groot respek vir Maarten van Rossum!!!
KiobMbswvMs,2023-07-19,Frederik van Steen,Geert is het wel gelukt
KiobMbswvMs,2023-07-19,Marniks Jansen,Warrig betoog.
KiobMbswvMs,2023-07-19,Frank Buis/RoyalPress Amsterdam,even onder u aandacht brengen hr. Maarten----------------->>>> onderstaande link
KiobMbswvMs,2023-07-19,Lenie van den Hurk,En PVV met Millioenen  moet ook mee regeren daar hebben de kiezers recht op anders maatregelen  bij de rechter
KiobMbswvMs,2023-07-19,Freerun Opa,never nooit niet
KiobMbswvMs,2023-07-19,Ninotschka Ooms,Verbaast mij niets.
KiobMbswvMs,2023-07-19,CorM,Geruststellende mededeling?  Je wordt oud van Rossem.
2vcpy99uzXU,2023-07-19,MrJlin1982,Ben ik niet met Van Rossum eens. De eerste kamer is belangrijk buiten haar historische meerwaarde en een Chamber de Reflection
jla-UbFIx4M,2023-07-20,the flying Dutchman,"CDA, gewoon lekker het politiek vergeet hoek je in."
Tf9LiwT9poY,2023-07-20,Yvonne Brands,"CDA is niet dé partij voor Omtzigt.laat Pieter zelf beslissen. Misschien eigen partij en MP worden, waar hij het beste in zal zijn."
Tf9LiwT9poY,2023-07-20,bikerboy674,Caroline heeft altijd gezegd dat ze midden rechts is.
Tf9LiwT9poY,2023-07-20,Pe Rietveld,"Nou, jullie hebben Van Omtzigt laten vallen dus hij zal wel gek zijn als ie terug zou gaan. Dat zou alleen maar zijn om die partij te redden. Van mij mag de C wel weggelaten worden"
Tf9LiwT9poY,2023-07-21,Roy-Aisha World of Tanks Console,Good Work out there!
Tf9LiwT9poY,2023-07-21,DEX,"cda een volkspartij, hahahaha. En praten over Omtzigt waar hij niet bij is, leer het vooral niet af."
KiobMbswvMs,2023-07-21,DEX,Grappig dat je zegt dat Wilders in de vette modder staat terwijl ik denk dat nederland in de modder wegzakt met een vette timmermans.
Tf9LiwT9poY,2023-07-22,john,Mensen met zijn principes en waarden een partij laten stichten waar hij als tweede kamer lid voor gaat uitkomen  met partijgenoten.
Tf9LiwT9poY,2023-07-22,Aart Schutte,Wat bizar... dat je niet eens meer het woord christelijk hoor bizar.... en dat van het CDA. Schande.
Tf9LiwT9poY,2023-07-23,Retepgreb,Kan BNR er niet beter voor kiezen om een televisie zender te worden. Nu is er dubbele uitstoot aan vervuiling.
Tf9LiwT9poY,2023-07-23,Rebel 82,"""Het gaat om de poppetjes "", nee mevrouw, het gaat over het beleid dat ons land naar de rand van de afgrond heeft gebracht.  En nee het gaat ook niet over het "" verhaal """
Tf9LiwT9poY,2023-07-23,johnwuyts,"Pieter moet nooit teruggaan naar dat zooitje CDA, nee hij moet samengaan met BBB of totaal anders SP"
KiobMbswvMs,2023-07-23,kenhvan,Als er iemand vet is dan is dat van Rossum
Tf9LiwT9poY,2023-07-24,jos zoet,Zeur niet over pietluttigheden maar ga samen op rechts. (Zonder VVD en de oude coalitiekliek )   Voor alles wat Rutte heeft laten liggen....
KiobMbswvMs,2023-07-24,hoi hoi,"Tja omzigt kan ook alleen, soort dictator met 46 zetels maar wel dan de eerste nette dictator"
hYQbEOOFWTk,2023-07-25,THXLIS,Brabooooooo
hYQbEOOFWTk,2023-07-25,Cleberson santos,Cda🔥🔥🔥
hYQbEOOFWTk,2023-07-25,Jhonatan martins,Foda
hYQbEOOFWTk,2023-07-25,Ryan Dela,Ja foi Detroit?
hYQbEOOFWTk,2023-07-25,Ryan Dela,Kell
Tf9LiwT9poY,2023-07-25,J,Ben ik het helemaal mee eens dat hij de meest betrouwbare politicus is en blijft. Ik ga zeker weten stemmen op hem als hij voor het premierschap gaat. Ik zal hem dan ook met honderduizenden steunen.
Tf9LiwT9poY,2023-07-25,jantrammelant,Als ik zie wat voor stem gedrag hij laat zien bij moties dan denk ik dat hij eerder naar de linkerkant gaat dan naar rechts
Tf9LiwT9poY,2023-07-25,martin nijs,"Hij kan niet terug, dan verliest hij zijn geloofwaardigheid. Ook niet naar BBB...hij blijft gewoon onafhankelijk doorgaan in de kamer..."
