videoId,publishedAt,authorDisplayName,textDisplay
QKRifMP1aeA,2023-08-13,Hans Ruitenberg,De EU is iig NIET sociaal-democratisch!!!
QKRifMP1aeA,2023-08-13,Doortje Leupens,15 cent
QKRifMP1aeA,2023-08-13,Bastiaan Stapelberg,"Bontenbal heeft,net als Foppe Hoekstra, nul sociale emphatie. Dus goede zaak op naar 3 zetels voor de Farizeeërspartij."
vZDq14iAHFM,2023-08-14,Willem de Boer,"Straks noemen ze bij het CDA jou naam nog Maarten, is in elk geval beter dan Bontenballen🤪🤪🤪"
vZDq14iAHFM,2023-08-14,Rederick Froders,Ik wens Harry Krentenbol veel succes
vZDq14iAHFM,2023-08-14,Willem de Boer,Maarten het wordt tijd dat jij de boel in Den Haag eens doorschut en orde op zaken gaat stellen. Bel Mark morgen en geef hem vrij zodat jij door kunt.
vZDq14iAHFM,2023-08-14,Arjan Visser,Armoedeprobleem? Misschien is het wel een bestedingspatroon probleem.
hLXy4yjRQ8M,2023-08-14,martien nab,Bontenbal moet nog beginnen en de Berlijnse muur is al weer opgebouwd wordt steeds gezelliger in nederland .
hLXy4yjRQ8M,2023-08-14,joop bos,De zelfoverschatting van deze man is grenzeloos
hLXy4yjRQ8M,2023-08-14,B,"Het valt me op dat bijna alle bezwaren die tegen het Forum en/of zijn leider worden ingebracht niet-inhoudelijk van aard zijn. Het is alsof Baudet een verdacht familielid is waar je je kinderen voor moet waarschuwen. Niet omdat dat familielid iets misdaan heeft, niet omdat hij onaardig of onbetrouwbaar is maar omdat hij afwijkt van wat gebruikelijk is."
hLXy4yjRQ8M,2023-08-14,Albert,"Tuuuurlijk, meteen uitsluiten😂😂😂😂"
hLXy4yjRQ8M,2023-08-14,Albert,FVD is de enige oplossing!!!
hLXy4yjRQ8M,2023-08-14,Pro Libertate,"Met deze lijsttrekker kiest het CDA om met het thema klimaat de verkiezingen in te gaan. Het linkse electoraat zal echter voor andere klimaatpartijen kiezen, zoals PvdAGL, D’66 of PvdD. Het CDA zal volledig marginaliseren."
hLXy4yjRQ8M,2023-08-14,VPN Consult,CDA naar 0.
hLXy4yjRQ8M,2023-08-14,Tatjana Jonge,FVD👊
hLXy4yjRQ8M,2023-08-14,Imright Imright,Ik will Wopke Hoekstra en Hugo de Jonge even bedanken voor het sloopen van het CDA en tennisbal je krijgt een functie elders van mij
hLXy4yjRQ8M,2023-08-14,Jan Alleijn,PVV/ FORUM FORZA….. ik zeg een ding GRISTENHONDEN….
fX_kB1b_mnA,2023-08-14,SkySartix(),"I just saw that henri has this in the retweets  "" Swearing, framing and shaming are not normal. What we don't accept in society is a revenue model for social media. On the street everyone is accountable for his or her behavior. That should also be normal online. """
fX_kB1b_mnA,2023-08-14,Bastiaan Stapelberg,Het CDA en normen en waarden😂😂😂
fX_kB1b_mnA,2023-08-14,ElBastardo74,CDA waarden en normen? Dat is een grap zeker?
fX_kB1b_mnA,2023-08-14,Rudolph Spieltfurgot,De CDA en waarde en normen. Ik nam net een slokje koffie😂. Ik kwam niet meer bij😂😂😂
fX_kB1b_mnA,2023-08-14,Nuli,"Bontenbal, de autoritaire engnek van corona en het klimaat."
fX_kB1b_mnA,2023-08-14,Stephen Van Wijk,"Ik zou iemand met een goeie naam kiezen. Op naar de nul zetels, ik verwachtte het al 13 jaar geleden, ik kijk er naar uit."
fX_kB1b_mnA,2023-08-14,Pro Libertate,"Links vindt klimaat het belangrijkste thema en rechts vindt immigratie het belangrijkste thema. Het CDA slaat hier definitief linksaf en zal daar geen successen boeken. Het linkse electoraat zal eerder voor PvdAGL, D’66 of een andere klimaat partij kiezen."
fX_kB1b_mnA,2023-08-14,Van de Berg,Bontebal wil iets meer met klimaat 😂😂😂😂😂😂😂😂😂😂😂😂
fX_kB1b_mnA,2023-08-14,Jimi Bol,Met Mona Keizer waren ze groot geworden 😂😂
fX_kB1b_mnA,2023-08-14,Andre Schenk,Wat is dit nu weer??? Een kale man kan geen MP worden???? Deze man had gelijk de studio moeten verlaten!😮
fX_kB1b_mnA,2023-08-14,clay rawsesib,"Ik ken de CDA van van Agt toenal fouteboel en nu een bontebal word niet beter, ach regeren kunnen ze beter vergeten."
fX_kB1b_mnA,2023-08-14,Michiel Janssen,"Ik wil de klimaatpaus ook ABSOLUUT niet als premier, maar niet vanwege zijn kapsel haha jezus, wat een domme observatie. Ook gelijk van de tafel geveegd met het verwijzen naar Pim Fortuyn."
fX_kB1b_mnA,2023-08-14,Walter Jurg,Hij was toch het schoothondje van Jetten?
fX_kB1b_mnA,2023-08-14,Jerry Lee,Wat een lachertje   😅
fX_kB1b_mnA,2023-08-14,Boaz Nood,😂😂😂😂😂😂😂😂😂
fX_kB1b_mnA,2023-08-14,Kirill in 't Veld,Arno Kantelberg is niet kaal…
fX_kB1b_mnA,2023-08-14,Blitar 1943,Door motregen  en christelijke wordt  je het  meest door bedonderd.
fX_kB1b_mnA,2023-08-14,The Doodleman,"Henri ""Bontnebal"" als CDA-redder?"
fX_kB1b_mnA,2023-08-14,Roland Te Booy,Den Uyl was kaal en toch premier ...
fX_kB1b_mnA,2023-08-14,Tom Lochem,Pleur lekker op met je CDA
fX_kB1b_mnA,2023-08-14,donniednl,Henri wie??
fX_kB1b_mnA,2023-08-14,Pietje Puk,Blablabla Bontebal
fX_kB1b_mnA,2023-08-14,Darky The Vampire 🦇,"Zo'n slechte keuze , iemand die een voorstander is van kern energie is wel het laatste wat we nodig hebben."
fX_kB1b_mnA,2023-08-14,Jimi Bol,Pim fortuin
fX_kB1b_mnA,2023-08-14,Paul Van Amersfoort,Wat een Non-discussie
fX_kB1b_mnA,2023-08-14,Harald Versteegden,Bontebal.......................is dat een serieuze naam ?         Bont Bal ?     lol WTF................... grootste probleem CDA is HUGO MENGELE !
cTkGEj5msHo,2023-08-14,Herre van schie,Een echte leider spreekt vanuit zijn hart en ziel en niet vanaf een opgeschreven tekst !
cTkGEj5msHo,2023-08-14,Marieke Thommis,Succes Henri! #samenvoorheelNederland 💚
cTkGEj5msHo,2023-08-14,Arjen Veerman,"Authentiek, intelligent, betrokken. Dit is precies wat Nederland nodig heeft. 💚"
cTkGEj5msHo,2023-08-14,Gerard Vlietveld,Fantastisch ik ben fan!
cTkGEj5msHo,2023-08-14,Vintrus,Publiekelijk afstand nemen van het WEF!! Zo niet dan weten wij genoeg dat dit weer loze praatjes zijn
cTkGEj5msHo,2023-08-14,MsVoeten,"Als ik eerlijk moet zijn, dan schat ik de kansen  ook met Broodje bal zeer slecht in voor een herstel bij het CDA!"
cTkGEj5msHo,2023-08-14,Van de Berg,Van een papiertje... tja... Zwarte stropdas geeft al aan. Ze zullen rouwen om het gigantische zetelverlies
cTkGEj5msHo,2023-08-14,Stone Capone,ik kom uit rdam zuid. maar dit lijkt wel team ninja turtles. dit niks met rotterdam zuid te maken ook. snap nie waarom die dat gebruikt. werk meer tegen hem waarschijnlijk dit.. oke VOLGENDE!
cTkGEj5msHo,2023-08-14,Stephen Van Wijk,Op naar de nul zetels.
cTkGEj5msHo,2023-08-14,J S,Verfrissend
cTkGEj5msHo,2023-08-14,Jaap deB,"Goed verhaal, hij heeft mijn stem"
cTkGEj5msHo,2023-08-14,JBHK,"Nieuwe gezichten, zelfde sloopagenda . . ."
cTkGEj5msHo,2023-08-14, Den Bogert,Ik ben zo blij dat na de verkiezingen het cda niet meer bestaat een partij zonder Vice Laat Hugo de Jonge zijn excuses aan bieden aan de on gevaccineerde
cTkGEj5msHo,2023-08-14,Catrien Bonnema,naar 2minuten aan te horen ben ik al broed
cTkGEj5msHo,2023-08-14,norma desmond,Ja...... dan kun je zien hoe het CDA eraan toe is als ze zo iemand aantrekken om lijsttrekker te worden. Dit gaat nog lager worden dan de peilingen al zijn.
cTkGEj5msHo,2023-08-14,John Saarloos,ruim 24 maanden te laat met het verhaal copy past by PvdA en G L   😂😂😂😂😂😂😂😂😂😂😂😂😂😂😂
cTkGEj5msHo,2023-08-14,John Saarloos,hahahahhhahahhahahahahhahahahahahhahahahahahhahaahhahahahhahahahhahhahhahahahhaha
WakwnO2oZJ8,2023-08-14,Yte van der Veen,"Bontebal ,een prima kandidaat, niks mis mee. Jammer dat sommige mensen direct negatief zijn."
WakwnO2oZJ8,2023-08-14,Jon Hagedoorn,"Alleen door de naam al, zou ik niet op hem stemmen........""Bonte Bal""......net zo iets als ""Blauwe Kloten""."
WakwnO2oZJ8,2023-08-14,R S,"Die Sjuul, Bruls voorstellen als CDA bulldozer.  Het ravijn in."
WakwnO2oZJ8,2023-08-14,Randy Marsh,Wat is het Bontenbal nou weer
WakwnO2oZJ8,2023-08-14,Dorus ,Pannekoek.
WakwnO2oZJ8,2023-08-14,Jasper van Baars,🤣Bontenbal...
WakwnO2oZJ8,2023-08-14,R S,"Huh, wat doet het zusje van mwr. Merkel daar?"
WakwnO2oZJ8,2023-08-14,Thrawn did nothing whrawng,Bruls 😂
WakwnO2oZJ8,2023-08-14,Service Verkoop,"de kleur maak niet uit, een bal is een bal"
W320SY-0N04,2023-08-14,Roel Reijgers,CDA kruipt altijd heel stevig tegen de VVD aan en ... is bovenloyaal aan de coalitie en ja hoor ... ze is koud weg of  meteen is haar 'kostje gekocht' en heeft ze 'n prachtig nieuw baantje geregeld ! Pfff  Kortom : de banencarrousel draait als 'n tierelier ! Triest !
QKRifMP1aeA,2023-08-14,Anonymous,"Die ondergrondse afvalcontainers zijn hartstikke goed, ze hebben er alleen te weinig neergezet voor de hoeveelheid afval die er geproduceerd wordt. Zet er nog een paar bij in de wijk en het probleem is opgelost."
QKRifMP1aeA,2023-08-14,Piet Keizer,Net artikel over Bontenbal gelezen…..lijkt mij een prima man. Ben overigens geen CDA er. Maar succes man.
QKRifMP1aeA,2023-08-14,Jas Pere,"Maarten, ""Nederland is nog steeds een redelijk functionerende democratie"" luister even naar de Thorbeckelezing van Omtzigt, die maakt er toch behoorlijk gehakt van!"
QKRifMP1aeA,2023-08-14,wappieforlife,Ik wil zoiezo geen ballen meer in de politiek
QKRifMP1aeA,2023-08-14,Wulfert Bontenbal,Hier meer uitleg over de nieuwe koers: https://youtu.be/cTkGEj5msHo?feature=shared
QKRifMP1aeA,2023-08-14,1960ewe,Waterstof kan niet getransporteerd worden met leidingen geschikt voor aardgas/propaan/butaan. Dus het bestaande net is ongeschikt.
QKRifMP1aeA,2023-08-14,Moez Makhlouf,Een van de min punten ik zal het ook niet achterlijk willen noemen is migratie. Waarom kunnen we niet de Sociale democraten in Denemarken als voorbeeld nemen en pakken we het probleem bij de kern. Wat kunt u zeggen over over het beleid van de sociale democraten in Denemarken ze hebben het redelijk goed aangepakt en daarom zijn ze een success in noord Europa.
QKRifMP1aeA,2023-08-14,Olaf Tulen,Wat vind U van de fusie tussen de PvdA en GroenLinks op de lange termijn?
QKRifMP1aeA,2023-08-14,Salvador Caralho,Een democratie kan alleen funcioneren met goede pers
QKRifMP1aeA,2023-08-14,Salvador Caralho,Verantwoording??
MkFV9eoYchM,2023-08-14,Cas,Het aantal abonnees van dit officiële kanaal zegt genoeg over de populariteit van deze WEF partij...
MkFV9eoYchM,2023-08-14,Willem Louwsma,"Henri wens je veel succes toe,en goed rentmeesterschap de komende jaren groeten willem 🚛😉👍🌹"
MkFV9eoYchM,2023-08-14,Gitareur,Het CDA is op sterven na dood. Hoe jammer voor deze meneer om voor een karretje gespannen te worden dat de afgrond in rijdt. Ik zie een 13 in een dozijn filmpje waar de C van het CDA geen plaats heeft gekregen. Dit is dus heel goed dat dit gebeurd.
MkFV9eoYchM,2023-08-14,Martin Pottker,"Rotterdam: geen woorden maar daden. Dat hebben we nodig. In Breda hebben we je meegemaakt, een vertrouwensvol verhaal met hoop voor de toekomst."
MkFV9eoYchM,2023-08-14,Hendrik Janssen,"Lekker urban allemaal, cda is echt achterban kwijt!"
MkFV9eoYchM,2023-08-14,Mattanja de Boer,Succes Henri. Heel gaaf dat jij het CDA weer een appèl wil laten doen op onze verantwoordelijkheid én die van de overheid voor samen leven in deze tijd.
MkFV9eoYchM,2023-08-14,Lucas 11,Betere marketing dan 'CDA een goede morgen' of 'wij plassen liever over u heen dan u over ons' zet hem op kerel
MkFV9eoYchM,2023-08-14,Marco Vermeulen,Het is nu heel duidelijk . Jullie laten nu een groot deel van jullie achterban in de steek. De mensen buiten de randstad. Heel jammer
MkFV9eoYchM,2023-08-14,Jolanda Wouda,"Aan de boom herken je de vrucht, ik ben benieuwd."
MkFV9eoYchM,2023-08-14,pierre1050,"Mooi verhaal maar achter het masker schuilt de hypocrisie. Geen enkel groot probleem wordt aangestipt in deze video, niks wordt concreet gemaakt. Hoe mak zijn de mensen nog dat ze hier in mee gaan?"
MkFV9eoYchM,2023-08-14,El Dee,Sterkte Henri als het CDA 1 zetel haalt en je alleen in de fractie zit.
MkFV9eoYchM,2023-08-14,Wichert Groothuis,"Beste Henri, Van harte gefeliciteerd. Ik ben blij dat jij de klas gaat doen. Gemakkelijk zal het niet zijn. Je geeft precies aan waaraan het geschort heeft da laatste jaren. Hopelijk schroom je niet tijdens de komende campagne om de waarden van het CDA te benoemen. Vergeet als westerling vooral de andere windstreken niet. Daar zijn veel stemmen (terug) te halen, juist vanwege onze waarden. Ik wens je veel wijsheid en succes. Wichert Groothuis CDA-lid en bestuurslid lokaal Elburg"
MkFV9eoYchM,2023-08-14,M Baali,"De PR-machine draait op volle toeren en zie daar, een uitgekiende video die de ongeloofwaardige holle standpunten van het CDA overbrengt. Deze jongeman zal niet in staat zijn om de aanzienlijke schade veroorzaakt door het CDA beleid onder Hoekstra te herstellen. Wat we momenteel aanschouwen, is een schijnvertoning van triomf - ""YES! We hebben iemand"" - of nauwkeuriger gezegd, een welwillend slachtoffer is opgedoken. CDA, jouw moment zal zich over 20 jaar opnieuw weer voordoen, maar voor nu verzoek ik u vriendelijk om afstand te houden!"
MkFV9eoYchM,2023-08-14,Van de Berg,Rotterdam interesseert mij geen bal.
MkFV9eoYchM,2023-08-14,Kees de Hoop,Gods zegen Henri! Zal je nodig hebben. Zet hem op! Eindelijk van die kliek af
MkFV9eoYchM,2023-08-14,Henriette van Ruitenbeek,Ga op deze voet verder zodat ik weer met trots kan zeggen ik ben een CDA -er
MkFV9eoYchM,2023-08-14,Han,"Uit een gezin van 8 kinderen..... Uit een tijd dat er kennelijk nog geen zorg was over de overbevolking en de daaruit voortvloeiende  milieuproblemen. Het kon de Heere ook niet veel schelen. Hoe meer, hoe beter."
MkFV9eoYchM,2023-08-14,Annemiek Nuijens,Succes gewenst !
MkFV9eoYchM,2023-08-14,J L,Henri Gehaktbal
MkFV9eoYchM,2023-08-14,Gerard Vlietveld,Henri Bontenbal komt over als een betrouwbare politicus. Ik wil het CDA voor nu zeker nog een kans geven.   Maar eerst alle campagnes afwachten.
vZDq14iAHFM,2023-08-15,jan aarts,cda? oja dat splinter partijtje!!!
vZDq14iAHFM,2023-08-15,MiNa,Henri Bontebal weigert samenwerking met PVV en FVD vanwege de democratie.... hahaha censuur in een democratie! Wordt wakker mensen! Loze frasen!
hLXy4yjRQ8M,2023-08-15,Jp,Kost het CDA weer een hoop stemmen...hoe kan je op voorhand andere partijen uitsluiten (cancelen)? Is geen democratische houding
hLXy4yjRQ8M,2023-08-15,Jan De jong,Hopelijk mag Henri het licht uitdoen voor het CDA...
hLXy4yjRQ8M,2023-08-15,Harmen Paalman,Wat een enge uitspraak direkt de D uit het cda halen. Oke blijft er niets over van de naam. Juist ook niet van deze partij. Al excuses aangeboden aan Omtzigt???
hLXy4yjRQ8M,2023-08-15,Sushi Sashimi,Waarden en normen... vervolgens zonder onderbouwing uitsluiten. Dan democratie benoemen...klinkt inspirerend zeg....
hLXy4yjRQ8M,2023-08-15,J Betsema,Dat zijn twee partijen die groter worden dan het cda. 😂😂😂
hLXy4yjRQ8M,2023-08-15,Reconquista.,Als ik zo naar de peilingen kijk is de poort waar Bontenbal het over heeft nog maar een heel klein poortje.
hLXy4yjRQ8M,2023-08-15,FERRY songs,"Wat een grote schoenen weer, en wat ondemocratisch!"
hLXy4yjRQ8M,2023-08-15,Wim Franken,"Bontebol, met z'n splinterpartij, is dus gewoon ONDEMOCRATISCH! Griezelig..."
hLXy4yjRQ8M,2023-08-15,de steen,Veel cda stemmers bij pvv?
hLXy4yjRQ8M,2023-08-15,Rob van Gelderen,Jammer maar ik ga lekker Forum stemmen 😅
hLXy4yjRQ8M,2023-08-15,Albert,"Wat wéét zo’n bal nou over Holland, nee geen bal dus"
hLXy4yjRQ8M,2023-08-15,Bastiaan Stapelberg,"Wat een arrogantie die Bontenbal😂.....denk, nee weet het zeker,  dat voor het CDA de poort van PVV, FvD gesloten blijft."
hLXy4yjRQ8M,2023-08-15,Cor Staneke,Stem voor de islamisering stem CDA😮😮😮
hLXy4yjRQ8M,2023-08-15,Woesmaro,"PVV uitsluiten was niet heel handig en daar gaat hij mogelijk spijt van krijgen, uitsluiten van de FVD is volkomen begrijpelijk"
fX_kB1b_mnA,2023-08-15,My own Home,Klimaat specialist 😆werkelijk lachwekkend!
fX_kB1b_mnA,2023-08-15,Peter Blok,Herstel van normen en waarden is zeker van het grootste belang. Het vraagt alleen wel om vertrouwen en dat heeft het CDA niet meer.
fX_kB1b_mnA,2023-08-15,Jan van Hal,Zou het CDA al een coalitieafspraakje hebben met Klimaatpaus?
fX_kB1b_mnA,2023-08-15,Erik Luken,Wanneer de Henri Bontebal documentaire van de staatsomroep VPRO?
fX_kB1b_mnA,2023-08-15,leo- 1-2-3,bye bye cda en alle andere partijen!
fX_kB1b_mnA,2023-08-15,henk M,Dat de pvda samen is gegaan met de CPN is een afgang voor beide partijen extreem links
cTkGEj5msHo,2023-08-15,jan smit,Pinokio word de nieuwe lijsttrekker 😂
cTkGEj5msHo,2023-08-15,aeshetic_girl hii,"Ik hoor mooie woorden, solidariteit,  wij samenleving, normen en waarden.  Maar ik mis: vanuit de christelijke achtergrond,  perspectief vanuit de Bijbel,  rentmeester zijn op aarde. Henri, ik wens je sterkte en kracht van boven."
cTkGEj5msHo,2023-08-15,Ruud Hooreman,"Vanaf het moment dat hij per definitie samenwerking met de PVV en FvD uitsloot,  had ik direct iets tegen hem. Maar hij wil wèl samenwerken met d66, een partij met ideeën die haaks staan op het CDA. Zo'n tegenstrijdigheid voorspelt niet veel goeds. Nou ja, wie weet haalt het CDA nul zetels en dan hóeft hij ook niet meer samen te werken met PVV en FvD."
cTkGEj5msHo,2023-08-15,Richard Lissenberg,Het komt niet oprecht over  cda blijft voor mij Christus  dacht  anders die gaat weer over eigen belang
cTkGEj5msHo,2023-08-15,Jon Hagedoorn,"Deze man praat, alsof hij zijn kinderen voorleest (Als hij ze heeft.....arme kinderen) ""En toen kwam de grote boze wolf"""
cTkGEj5msHo,2023-08-15,Ruud Hooreman,"Het klinkt mooi: Solidariteit, Wij-samenleving, Normen, Waarden en Fatsoen. Maar er zijn tallozen die onze normen en waarden verwerpen en westerlingen discrimineren. Wat gaat hij daartegen doen? En wat Fatsoen betreft, is het fatsoenlijk om nieuwkomers voorrang te geven op een huurwoning, tov mensen die al jaren op zo'n woning wachten?"
cTkGEj5msHo,2023-08-15,Kees van Beek,Wat een slap verhaal weer... zo uit de kast getrokken van een anders speech.. WEF partij...
cTkGEj5msHo,2023-08-15,w a,😂
cTkGEj5msHo,2023-08-15,gemaild,Een watje dat er staat.
cTkGEj5msHo,2023-08-15,IJsbrand Leendert,Flugel Bontenbal
cTkGEj5msHo,2023-08-15,IJsbrand Leendert,Hij zou het flugel dopje eens van zijn neus moeten halen
cCUl7qMsI-g,2023-08-15,Omroep PowNed,Verwacht jij dat Henri Bontenbal het CDA er weer bovenop krijgt?
cCUl7qMsI-g,2023-08-15,Flippo92,"Pleurt op. Wie zit er nu nog te wachten op een partijleider, die vooral over het klimaat en milieu gaat. We hebben huizen nodig en betaalbaren openbare vervoer. En alsjeblieft vergeet de oudere niet. De zorg is voor ons zeer belangrijk in de maatschappij."
cCUl7qMsI-g,2023-08-15,MrKarregast,"Men zegt: ogen zijn de spiegels van de ziel, kijk goed naar deze man en je weet wat het voor iemand is."
cCUl7qMsI-g,2023-08-15,Rolf Agten,Henri Luilebal is ook zo'n Prikpooier zag ik op Nine for news.🦁
cCUl7qMsI-g,2023-08-15,H,Oude wijn in nieuwe zakken van Henri mottebal
cCUl7qMsI-g,2023-08-15,Marc L.,Het feit dat je onbekend bent in de politiek kan een enorm voordeel zijn. Tijd zal het uitwijzen of hij hierop kan kapitaliseren.
cCUl7qMsI-g,2023-08-15,Wim Franken,"Deze ""Bontebol"" is zo arrogant om op voorhand al partijen uit te sluiten voor samenwerking... Ik pas ook voor een partijleiderschap van het CDA en stem op Omtzigt!"
cCUl7qMsI-g,2023-08-15,Robbie T,"Waarom verlaten ze allemaal het zinkende schip? Omdat met een nieuw kabinet er een beerput opengaat. Rutte ging weg en allemaal smeerden ze hem omdat ze wisten dat nu de deksel gelicht was. Behalve van Leijten, Azarkhan en nog een paar (ik denk dat die zich bij Omtzigt gaan voegen in een nieuwe partij"
cCUl7qMsI-g,2023-08-15,Jan De jong,Ze zijn het zwarte balkje vergeten...
cCUl7qMsI-g,2023-08-15,Albert,Allemaal met de staart tussen de benen weg en ze kómen overal mee weg
cCUl7qMsI-g,2023-08-15,Arnout Bolman,"Probeer ns n interview met deze nieuwe bal. Hij zit om veel aandacht verlegen, lijkt me"
cCUl7qMsI-g,2023-08-15,ThaStayFan,En dan over een jaar dit filmpje weer kijken als ie onze premier is... 😂
cCUl7qMsI-g,2023-08-15,Iemand Anders,Henry kweilenbal met zijn gezin voorop . Ik heb het CDA niet nodig om mijn gezin te onderhouden of wat dan ook .
cCUl7qMsI-g,2023-08-15,Starscream,Een naam die niemand ooit gehoord heeft om een partij te leiden waar niemand meer om geeft. Ik hoop dat de VVD met de nieuwe lijsttrekker hetzelfde lot wacht.
cCUl7qMsI-g,2023-08-15,Kniep Stuuver,"Henry Teelbal ken ik niet, maar een Eierbal gaat er wel in."
cCUl7qMsI-g,2023-08-15,wappieforlife,Geen balletjes meer in de politiek aub
cCUl7qMsI-g,2023-08-15,A L,Henri Bowlingbal for president
cCUl7qMsI-g,2023-08-15,Redouan,Bontekont !
cCUl7qMsI-g,2023-08-15,Juul Vd Sangen,Daar in tegen is de rest van cda over bekent.
cCUl7qMsI-g,2023-08-15,Hubert VRIES,"ik gelooft niet in hem, volgens mij gaat hij het niet waar maken."
cCUl7qMsI-g,2023-08-15,Arjen van Doorne,En toch blijf ik maagd.
cCUl7qMsI-g,2023-08-15,Eindhoven Vuurwerk,Die Bontebal doet de PVV en FVD al bij voorbaat uitsluiten.. Daarvoor moet je ook wel zetels gaan halen..   Zullen we religieuze geïndoctrineerde ook gaan uitsluiten ook al verbied de grondwet dat?
cCUl7qMsI-g,2023-08-15,Justin,Geen idee wie deze notenbal is maar gaat toch niet werken
cCUl7qMsI-g,2023-08-15,wappieforlife,Is het ook een neus of een echte Nederlander?
cCUl7qMsI-g,2023-08-15,casper de bruin,vies vies en nog eens vies dat politiek . als hij een partij begint stem ik op pieter
cCUl7qMsI-g,2023-08-15,Denzel,❌❌❌
cCUl7qMsI-g,2023-08-15,upwk7,Boterbal
cCUl7qMsI-g,2023-08-15,M M,Heel slecht dit weer
cCUl7qMsI-g,2023-08-15,Ciro Di Marzio,Kont en bal
WakwnO2oZJ8,2023-08-15,TheRtm68,"CDA, ze praten over democratie maar sluiten partijen uit?????? Juist in een democratie hoor je critische tegengeluiden te horen anders praat je over dictatoriaal bestuur!"
WakwnO2oZJ8,2023-08-15,jos van schijndel,Op naar nul zetels
WakwnO2oZJ8,2023-08-15,gemaild,Bontenbal? een stevig watje.
QKRifMP1aeA,2023-08-15,Peter Wellner,Leuk goed en leerzaam hoe u zich onder woorden weet te brengen waarvoor dank
QKRifMP1aeA,2023-08-15,Marjorie de Vries,Maarten ik leer zoveel van jou je bent geweldig
QKRifMP1aeA,2023-08-15,Max de kriek,heel goed dit!!!!...
QKRifMP1aeA,2023-08-15,Klaas de Boer,"Ik vind het, wellicht doordat ik teveel videos met Richard Dawkins gezien heb, byzonder dat je na een studie natuurkunde gelooft in een god en een heilig compleet onsamenhangend boekwerk."
QKRifMP1aeA,2023-08-15,jan aarts,"als bontebal al gelijk begint met uitsluiten, weet ik nu al dat ze afzakken naar een splinterpartijtje"
QKRifMP1aeA,2023-08-15,Dutch Chess better than cheese.,"Bontenbal sluit bepaalde andere partijen uit. Dat is voor mij een NO-GO voor deze partij die ons al zo in de steek liet, want het is niet democratisch."
QKRifMP1aeA,2023-08-15,Ed Admiraal,Waar en van wie is die auto? Welk meer is het? Wie weet hier meer over?
QKRifMP1aeA,2023-08-15,jan smit,Hij heeft er een neusje voor.
MkFV9eoYchM,2023-08-15,JH,En dan praten over democratie maar tegelijkertijd partijen uitsluiten. Malloot.
MkFV9eoYchM,2023-08-15,Irene Sangster,Als je normen en waarden hebt dan sluit je niemand uit
MkFV9eoYchM,2023-08-15,Frans vB,Gefeliciteerd met deze verantwoordelijke taak. Het is bemoedigend hoe je jezelf introduceert met je visie en je plannen. Het zal zeker positief ontvangen worden waarvan in de mediareacties al duidelijk wordt getuigd.
MkFV9eoYchM,2023-08-15,daan g e rous,Hallo ik ben de nieuwe #trekpop in het CDAaaaa en ik begin met het democratisch uitsluiten van partijen zoals pvv en fvd.
BpXGuI16DpM,2023-08-15,WNL,Lees meer: https://wnl.tv/2023/08/15/cda-prominent-gerd-leers-cda-moet-pvv-op-voorhand-niet-uitsluiten/
BpXGuI16DpM,2023-08-15,gvdschoot,"Interessant. Dus CDA sluit PVV uit. Nou, ik wens ze heel veel succes bij het CDA. Maar gezien Hugo de Jonge er ook bij zit stem ik niet op CDA. Dat is mij helemaal duidelijk. Daar heb ik geen stemwijzer voor nodig. Het CDA is zo ver afgezakt en heeft ook helemaal niets gedaan om de polarizatie te voorkomen. En ik ben tegenwoordig ook redelijk fel tegen alles wat ook maar ruikt naar EU, WEF en WHO."
BpXGuI16DpM,2023-08-15,Dominus,Alsof er nog wat over is van het Cda straks 🤡
BpXGuI16DpM,2023-08-15,Irene Sangster,Zo is het niemand uitsluiten
BpXGuI16DpM,2023-08-15,Jan Elema,"Naar een fatsoenlijk land streven en mogelijk optrekken met de pvc? De krimp lijkt de enige verandering te zijn,het denkraam is gelijk gebleven."
BpXGuI16DpM,2023-08-15,Ry Bik,Laten we hopen heel hoog...!
BpXGuI16DpM,2023-08-15,Jon Hagedoorn,"Ben je als ex-politicus nog steeds prominent, als je al met één been in het graf staat. De toekomst van deze man, ligt al ver achter hem."
BpXGuI16DpM,2023-08-15,cactusman07pim,"Het is jammer dat er zo veel verschil tussen CDAers is, deze man kom weer degelijk over."
BpXGuI16DpM,2023-08-15,Imright Imright,Wij sluiten de CDA uit komende verkiezingen FUNCTIE ELDERS VOOR jou en de rest van filkkers
vZDq14iAHFM,2023-08-16,Aragorn Strider,Wie hebben ze uit de mottenballen gehaald ?
ofZxmuFcOEM,2023-08-16,Rotterdam-West-010,Wat Hugo de jonge en wobke Hoekstra hebben gesloopt valt niet meer te repareren
ofZxmuFcOEM,2023-08-16,Jan De jong,"Hoogmoed komt voor de val, laten we hopen dat Henri het CDA in vrije val brengt en het partijtje in een bodemloze put doet storten..."
ofZxmuFcOEM,2023-08-16,WilH,Hoe Christelijk is dat: De PVV uitsluiten ? Vertel dat eens Bonte bol.
ofZxmuFcOEM,2023-08-16,Maria Damen,Het CDA gaat hopelijk niet zoveel zetels halen.
ofZxmuFcOEM,2023-08-16,Rene,De premier van NL zou een verbinder moeten zijn ipv een uitsluiter en voor de democratie ipv ertegen. Anders verandert er in dit land helemaal niets en worden grote groepen uit de samenleving uitgesloten en raken nog meer ontevreden.
ofZxmuFcOEM,2023-08-16,Peter Vermeer.,Willen de ouders van Bontenbal direct onmiddelijk naar de Ballenbak komen. Hij zit al twee uur uur in de ballenbak en wil er niet meer uit komen. En jaagt de andere kinderen steeds weg.
ofZxmuFcOEM,2023-08-16,Albert,"CDA is klein clubje, ik zou maar een beetje bescheidener worden"
