videoId,publishedAt,kind,title,description,channelTitle,liveBroadcastContent
1AZVU80uewo,2023-07-07,youtube#video,‘Dit kan de VVD zich niet permitteren’,Na een nacht lang vergaderen is het de crisis binnen het kabinet over de asiel- en migratieproblematiek nog niet opgelost.,De Telegraaf,none
E-KRPywJSlU,2023-07-07,youtube#video,Ferry van Wijnen van partijcommissie Asiel en Migratie VVD wil dat Rutte voet bij stuk houdt | Op1,Ferry van Wijnen van de partijcommissie Asiel en Migratie VVD wil dat Rutte vooral voet bij stuk houdt. ''Het is wat ons betreft een ...,Op1,none
CTmkglDdVtU,2023-07-08,youtube#video,Wil de VVD gaan samenwerken met de BBB van Caroline van der Plas? | Op1,VVD-fractievoorzitter Sophie Hermans over samenwerking met BBB: ''Ik wil samenwerken met partijen die bereid zijn afspraken te ...,Op1,none
dZtT4Ua1EpA,2023-07-09,youtube#video,Hugo de Jonge: &quot;De VVD escaleerde van de kelder naar de zolder&quot; | Op1,"Even terug in de film”, zegt Hugo de Jonge. “Het ging mis op de woensdag. Daar escaleerde de VVD van de kelder naar de ...",Op1,none
HtiZeBrvONA,2023-07-10,youtube#video,Eerste kandidaat lijsttrekkerschap VVD bekend: oud-Kamerlid André Bosman,Voormalig VVD-Tweede Kamerlid André Bosman stelt zichzelf kandidaat voor het lijsttrekkerschap van de VVD. Lees meer: ...,WNL,none
4R-z3xwTEv8,2023-07-10,youtube#video,Clash tussen VVD’er en PvdD’er: ‘Jullie denken dat Nederlanders hier te dom voor zijn’,Esther Ouwehand (PvdD) onderbreekt Sophie Hermans (VVD) tijdens haar betoog. Abonneer je hier gratis: ...,De Telegraaf,none
_w07K5738Jg,2023-07-11,youtube#video,&#39;VVD woedend om mes in de rug door Kaag’,Een dag na een historische politieke dag bespreekt Wouter de Winther met Pim Sedee wat er allemaal is gebeurd in Den Haag.,De Telegraaf,none
QHoSko4FzsQ,2023-07-11,youtube#video,VVD&#39;er valt kritische journalist aan!,,KafkaNL,none
QHoSko4FzsQ,2023-07-11,youtube#video,VVD&#39;er valt kritische journalist aan!,,KafkaNL,none
1QYH43Hi4_0,2023-07-11,youtube#video,VVD-kiezer maakt duidelijk: &#39;Zij moet het niet gaan doen&#39;,Jeroen Holtrop is in de duurste straat van Nederland om te vragen wie Mark Rutte zou moeten opvolgen als leider van de VVD.,De Telegraaf,none
7hiIExfbwwk,2023-07-11,youtube#video,VVD perschef valt aan,vvd #markrutte.,Left Laser,none
a9WLoQYLti8,2023-07-11,youtube#video,Aangevallen door VVD-medewerker en Rutte stapt op,Rutte is weg maar rekenen wij ook af met de VVD ideologie? Jij kan ons helpen de hele verkiezingscampagne krachtige content ...,Left Laser,none
qiwPJEp-qVc,2023-07-11,youtube#video,"Van der Plas (BBB) VS VVD: &quot;Jullie doel is 0,000036 graden minder opwarming, ten koste van alles!&quot;",Deze video is gemaakt door PolitiekTV* Tijdens debat van 10-7-2023 Wil je PolitiekTV steunen? Dat kan via: ...,Politiek TV,none
g2tHZH7sY5M,2023-07-11,youtube#video,Hierom wil Klaas Dijkhoff geen VVD-leider worden,"Wil je op de hoogte blijven van nieuwe uploads, abonneer je dan (gratis) via deze link: https://bit.ly/3ck0Xix Maarten van Rossem ...",Maarten van Rossem - De Podcast,none
qC1ACKbp914,2023-07-12,youtube#video,VVD-prominent Joustra: zet mes in aantal bewindslieden,Oud-topambtenaar Tjibbe Joustra vindt 29 bewindslieden te veel en adviseert het nieuwe kabinet dit aantal te verminderen.,WNL,none
vtS0XI-zchE,2023-07-12,youtube#video,"Dilan Yesilgöz wil Mark Rutte opvolgen, krijgt brede steun VVD-fractie",'Wegens het grote aantal vrouwonvriendelijke en racistische berichten is besloten de commentsectie uit te zetten' Dit is een ...,BNR,none
2T448P98G8s,2023-07-14,youtube#video,Lijsttrekker Dilan Yesilgoz-Zegerius stelt zich voor,Wil je niets missen van Dilan en alles wat er bij de VVD gebeurt? Abonneer!,VVD,none
QRGPQ-wML5A,2023-07-24,youtube#video,Voormalig VVD-leider Ed Nijpels roept Yeşilgöz op afstand te nemen van uitspraken Brekelmans,Voormalig VVD-partijleider Ed Nijpels roept kandidaat-lijsttrekker Dilan Yeşilgöz op de opmerking van Tweede Kamerlid Ruben ...,WNL,none
QRGPQ-wML5A,2023-07-24,youtube#video,Voormalig VVD-leider Ed Nijpels roept Yeşilgöz op afstand te nemen van uitspraken Brekelmans,Voormalig VVD-partijleider Ed Nijpels roept kandidaat-lijsttrekker Dilan Yeşilgöz op de opmerking van Tweede Kamerlid Ruben ...,WNL,none
nlyM-Jnlh8Y,2023-07-31,youtube#video,Virgil van Dijk appointed new Liverpool captain | &#39;It&#39;s time to get to work&#39;,"Hear from LFC's new team captain Virgil van Dijk, who has been appointed as the successor to the departing Jordan Henderson, ...",Liverpool FC,none
Db4MKqETLEk,2023-08-04,youtube#video,BIZAR! VVD&#39;er heeft verklaring gelezen die NIET bestaat  en wordt vervolgens Minister!,,Politiek TV,none
seYTJ4mxDwI,2023-08-30,youtube#video,🎯 Virgil van Dijk is… ‘The Finisher’ #LFC #Shorts #VVD,,Liverpool FC,none
1rjAqbV6m_k,2023-09-05,youtube#video,VVD-leider Yesilgöz wil bij winst verkiezingen het kabinet in,"Als de VVD bij de volgende verkiezingen de grootste partij wordt, wil partijleider Dilan Yesilgöz het kabinet in. Lees meer: ...",WNL,none
VkHOdpI9jE0,2023-09-05,youtube#video,Yeşilgöz deelt migratieplan VVD: instroom beperken en plek voor echte vluchtelingen,"""Hele concrete en realistische plannen"", dat is wat volgens VVD-lijsttrekker Dilan Yeşilgöz in het partijprogramma van de VVD ...",WNL,none
VeWva0VGfaw,2023-09-07,youtube#video,Nieuwe kandidatenlijst VVD | Studentennieuws | De Avondshow met Arjen Lubach (S4),Steeds meer studenten blijven bij hun ouders wonen. Gelukkig is er nu voor hen een manier om toch het studentenleven te ...,De Avondshow met Arjen Lubach | VPRO,none
cZwqGYBiL-0,2023-09-07,youtube#video,Analyse nieuwe VVD-lijst: ‘Mensen zijn hier verbaasd over’,"De kandidatenlijst van de VVD voor de Tweede Kamer is bekend. In de top-10 staan zeven vrouwen, en de partij kiest voor politici ...",De Telegraaf,none
9kVz26avOp8,2023-09-07,youtube#video,Zeven vrouwen in de top tien voor de VVD: &#39;Mooie lijst met verdeling over regio&#39;s en ervaring&#39;,Zeven vrouwen staan in de top tien van de VVD-kieslijst voor de Tweede Kamerverkiezingen. Dat meldt De Telegraaf. Lees meer: ...,WNL,none
XI9X_EXSIPc,2023-09-12,youtube#video,Onze lijsttrekker Dilan Yeşilgöz-Zegerius over de snelwegblokkade van Extinction Rebellion,Wil je niets missen van Dilan en alles wat er bij de VVD gebeurt? Abonneer!,VVD,none
c4Y7jToKQK4,2023-09-20,youtube#video,"Baudet (FVD) CLASHT met VVD, 3 MILJOEN immigranten naar Nederland? Algemene Beschouwingen 2023",13 jaar VVD. Vier keer regeringsdeelname. Bijna 3.000.000 immigranten. Dit zijn ontluisterende cijfers voor een partij die steeds ...,Forum voor Democratie,none
FRvIonsi96s,2023-09-20,youtube#video,Omtzigt legt aan Sophie Hermans uit hoe de VVD ook de middenklasse de armoede injaagt,Fragment uit de algemene politieke beschouwingen van 20 september 2023.,Bert Brandsma,none
KjTSiCtFHSI,2023-09-20,youtube#video,Hoe betrouwbaar is de VVD? | Joost Eerdmans tijdens de APB2023,Miljoenen werkende Nederlanders en ondernemers dreigen buiten de boot te vallen. Zij maken geen aanspraak op toeslagen en ...,JA21,none
1wNChEjE5xw,2023-09-20,youtube#video,Hilariteit in Tweede Kamer na betoog Hermans: ‘Die zat’,"Sophie Hermans (VVD) en Caroline van der Plas (BBB) hebben een 1-2'tje tijdens de Algemene Politieke Beschouwingen, wat ...",De Telegraaf,none
vpad-U7-6dc,2023-09-20,youtube#video,De benzinerijder is de klos | De Avondshow met Arjen Lubach (S4),De VVD is er behoorlijk goed in: pomppopulisme. Benzine goedkoper maken om stemmen te winnen. Maar wie profiteert hier nou ...,De Avondshow met Arjen Lubach | VPRO,none
GrbHQyj_oFk,2023-09-21,youtube#video,Baudet snapt aanval Wilders niet: &#39;Hij wil meedoen met VVD!&#39;,Thierry Baudet kreeg tijdens de Algemene Beschouwingen een aanval uit onverwachte hoek te verwerken. Geert Wilders verweet ...,Omroep PowNed,none
cp0F4_FZwRc,2023-09-23,youtube#video,Verkiezingscongres VVD - 23 september 2023,Wil je niks missen van Dilan en alles wat er bij de VVD gebeurt? Abonneer!,VVD,none
FXR02pTbq98,2023-09-25,youtube#video,&#39;Rare toespraak&#39; Dilan Yesilgöz op VVD-congres,"Wil je op de hoogte blijven van nieuwe uploads, abonneer je dan (gratis) via deze link: https://bit.ly/3ck0Xix Maarten van Rossem ...",Maarten van Rossem - De Podcast,none
-wFYJ97V4C0,2023-09-26,youtube#video,Speech Dilan Yeşilgöz-Zegerius op het verkiezingscongres,Wil je niets missen van Dilan en alles wat er bij de VVD gebeurt? Abonneer!,VVD,none
beNWyRmg2Ag,2023-10-10,youtube#video,De weg van onze lijsttrekker Dilan Yeşilgöz-Zegerius.,Wil je niets missen van Dilan en alles wat er bij de VVD gebeurt? Abonneer!,VVD,none
1tRNZlDr-_g,2023-10-20,youtube#video,VVD-lijsttrekker Dilan Yeşilgöz waakt voor &#39;risico op halfbakken oplossingen&#39; met linkse partijen,VVD-lijsttrekker Dilan Yeşilgöz ziet een 'risico op halfbakken oplossingen' als haar partij in een coalitie stapt met de linkse ...,WNL,none
4xIpyfzEBuo,2023-10-24,youtube#video,Waar gaat Johan op stemmen bij de komende Tweede Kamerverkiezingen? | VANDAAG INSIDE,Johan denkt te weten op wie hij gaat stemmen bij de komende Tweede Kamerverkiezingen. Kijk iedere werkdag om 21.35u naar ...,Vandaag Inside,none
YczVyQMvxgw,2023-10-25,youtube#video,Lijsttrekker Dilan 🥊 Rico Verhoeven,Deze video is onderdeel van een brede campagne van NOC*NSF om aandacht te vragen voor het belang van sport op de ...,VVD,none
mYHYZ4aoeNI,2023-10-29,youtube#video,De politieke partijen uitgelegd,"De Tweede Kamerverkiezingen komen eraan, dus je krijgt van ons zeventien politieke partijen uitgelegd. Ga hieronder meteen ...",NOS op 3,none
LdKVEQwW-dg,2023-10-29,youtube#video,Geert Wilders (PVV); &#39;ZE WILDE MIJ VERMOORDEN!&#39; Wat doet de VVD met een veroordeelde Terrorist?,Geert Wilders (PVV); 'ZE WILDE MIJ VERMOORDEN!' Wat doet de VVD met een veroordeelde Terrorist? Vragenuur 17 oktober ...,MediaGround,none
nZnds9oZ2uA,2023-10-30,youtube#video,"Soumaya Sahla uit VVD gezet om ontfutselde geldbedragen Frits Bolkestein, BBB stapt naar NCTV","De VVD heeft het partijlidmaatschap van Soumaya Sahla, die lid was van de extremistische Hofstadgroep, met onmiddellijke ...",WNL,none
bPWdSIzk7QE,2023-10-31,youtube#video,VVD-stemmer Zenna (19) krijgt links stemadvies | WTF MOET IK STEMMEN? #2 | NPO 3,"Zenna is 19 jaar en komt uit Almere. Ze is vaak onderweg, maar zowel het OV als de auto worden dreigen onbetaalbaar te ...",NPO 3,none
osvOtbiAbks,2023-11-01,youtube#video,Dilan staat aan jouw kant.,Wil je niets missen van Dilan en alles wat er bij de VVD gebeurt? Abonneer!,VVD,none
jDciav39KSs,2023-11-01,youtube#video,VVD-lijsttrekker Yeşilgöz: &#39;Partijen beschouwen ondernemers als bankautomaat&#39;,"Dit is een fragment uit BNR's Big Five met presentator Art Rooijakkers. Te gast is VVD-lijsttrekker Dilan Yeşilgöz, die kritiek uit op ...",BNR,none
TOUhcoMVIQo,2023-11-02,youtube#video,Van der Plas (BBB) x Yesilgöz (VVD),In het NOS op 3 Verkiezingsprogramma gaan Caroline van der Plas (BBB) en Dilan Yesilgöz (VVD) in gesprek met twintigers en ...,NOS op 3,none
560Xa30ERTc,2023-11-02,youtube#video,Dilan Yeşilgöz ging van SP naar VVD: &#39;Ik was helemaal klaar met links&#39;,"Dit is een fragment uit BNR's Big Five met presentator Art Rooijakkers. Te gast is VVD-lijsttrekker Dilan Yeşilgöz, die vertelt over ...",BNR,none
8PTbqTGxU9c,2023-11-05,youtube#video,VVD en GL-PvdA botsen tijdens debat over woningmarkt: &#39;Hiermee gaan we het niet oplossen&#39;,Het woningtekort oplossen vereist migratiebeperking. Dat stelt VVD-fractievoorzitter Sophie Hermans in het WNL-debat met de ...,WNL,none
7x0j_gZQlHo,2023-11-06,youtube#video,Analyse VVD-programma: &#39;Beschamende lulkoek!&#39;,"Wil je op de hoogte blijven van nieuwe uploads, abonneer je dan (gratis) via deze link: https://bit.ly/3ck0Xix Maarten van Rossem ...",Maarten van Rossem - De Podcast,none
3kuRyYaze_g,2023-11-06,youtube#video,Onze lijsttrekker Dilan bereidt zich voor op het RTL debat,Wil je niets missen van Dilan en alles wat er bij de VVD gebeurt? Abonneer!,VVD,none
_XcLlpNoR3U,2023-11-07,youtube#video,Onze lijsttrekker Dilan bij Radio 1,Wil je niets missen van Dilan en alles wat er bij de VVD gebeurt? Abonneer!,VVD,none
8F1q6j0KV2o,2023-11-07,youtube#video,"VVD, PVV en CDA in debat over migratie - NOS Nederland Kiest | NPO Radio 1","Dilan Yeşilgöz (Volkspartij voor Vrijheid en Democratie), Geert Wilders (Partij voor de Vrijheid) en Henri Bontenbal ...",NPO Radio 1,none
nR6TqB2RDpo,2023-11-07,youtube#video,Jesse Klaver (GL-PvdA) hoopt op &#39;kabinet zonder VVD&#39;,"Dit is een fragment uit BNR's Big Five met presentator Diana Matroos. Te gast is Jesse Klaver, de nummer drie van ...",BNR,none
7seCE8tC6dE,2023-11-07,youtube#video,"VVD, GroenLinks-PvdA en PVV over oorlog tussen Israël en Hamas - NOS Nederland Kiest | NPO Radio 1","Dilan Yesilgöz (VVD), Frans Timmermans (GroenLinks-PvdA) en Geert Wilders (PVV) debatteren in het radiodebat van de NOS ...",NPO Radio 1,none
XU99JTYYKsQ,2023-11-11,youtube#video,VVD-lijsttrekker Dilan Yesilgoz staat niet te springen om een minderheidskabinet | Op1,VVD-lijsttrekker Dilan Yesilgoz staat niet te springen om premier te worden van een minderheidskabinet. “Het heeft niet mijn ...,Op1,none
VUB0u0sMREI,2023-11-11,youtube#video,Dilan Yesilgoz-Zegerius in gesprek met ondernemers,Wil je niets missen van Dilan en alles wat er bij de VVD gebeurt? Abonneer!,VVD,none
QU7NdaAiGhY,2023-11-11,youtube#video,Dilan Yesilgöz (VVD) over wonen en migratie,In aanloop naar de Tweede Kamerverkiezingen spreekt AT5 verschillende lijsttrekkers in de Schreierstoren in Amsterdam.,AT5,none
j28xvFuCaZo,2023-11-12,youtube#video,Maarten fileert de VVD,"Wil je op de hoogte blijven van nieuwe uploads, abonneer je dan (gratis) via deze link: https://bit.ly/3ck0Xix Maarten van Rossem ...",Maarten van Rossem - De Podcast,none
nK_jFLjq32s,2023-11-12,youtube#video,Dilan Yeşilgöz (VVD) over onderwijs en haar basisschooltijd,Editie NL gaat speeddaten met de meest prominente lijsttrekkers. Zij gaan op 'date' met leden van het RTL Nieuwspanel. In deze ...,RTL Nieuws,none
VkW2locxF0E,2023-11-12,youtube#video,Rico Verhoeven | Even Tot Hier | Seizoen 10,"Als je samen met een lijsttrekker een filmpje maakt, denkt iedereen dat je van die partij bent. Dat overkwam kickbokser Rico ...",Even Tot Hier,none
-WHpi8gcJ_I,2023-11-14,youtube#video,Onze lijsttrekker Dilan bij Radio 1 over middengroepen en wat wij voor hen doen,Wil je niets missen van Dilan en alles wat er bij de VVD gebeurt? Abonneer!,VVD,none
38UU_jjV5DQ,2023-11-14,youtube#video,TERUGKIJKEN | Dilan Yeşilgöz (VVD) beantwoordde jullie vragen,Van 6 t/m 21 november legt verslaggever Albert Bos iedere werkdag om 9.15 uur jullie vragen live voor aan een lijsttrekker.,NOS,none
yrM18g7Pam0,2023-11-15,youtube#video,Frans Timmermans (GroenLinks-PvdA) haalt uit naar VVD,Lijsttrekker van GroenLinks-PvdA Frans Timmermans sluit een coalitie met de VVD niet volledig uit. Maar de liberalen moeten dan ...,WNL,none
sCsSNdNHcpM,2023-11-15,youtube#video,Johan kritisch in gesprek met Dilan Yeşilgöz: ‘Rutte heeft gefaald’ | VANDAAG INSIDE,Johan uit in gesprek met Dilan Yeşilgöz kritiek op het beleid van de VVD onder Mark Rutte. Kijk iedere werkdag om 21.35u naar ...,Vandaag Inside,none
yrM18g7Pam0,2023-11-15,youtube#video,Frans Timmermans (GroenLinks-PvdA) haalt uit naar VVD,Lijsttrekker van GroenLinks-PvdA Frans Timmermans sluit een coalitie met de VVD niet volledig uit. Maar de liberalen moeten dan ...,WNL,none
Ti8CPD3DTC4,2023-11-15,youtube#video,Lijsttrekker Dilan Yeşilgöz-Zegerius rijdt mee in De Hofkar,Wil je niets missen van Dilan en alles wat er bij de VVD gebeurt? Abonneer!,VVD,none
-GosABdpP-g,2023-11-17,youtube#video,Onze lijsttrekker Dilan Yeşilgöz-Zegerius bij Het Debat van Nederland,Wil je niets missen van Dilan en alles wat er bij de VVD gebeurt? Abonneer!,VVD,none
FsmI9QJWeTI,2023-11-17,youtube#video,Onze lijsttrekker Dilan Yeşilgöz-Zegerius bij Shownieuws,Wil je niets missen van Dilan en alles wat er bij de VVD gebeurt? Abonneer!,VVD,none
fnHHPtd8X88,2023-11-18,youtube#video,&#39;&#39;Omtzigt een van de grootste slachtoffers van het gedrag van de VVD&#39;&#39; | Op1,"''Ik begrijp niet van Omtzigt dat hij open staat voor samenwerking met de VVD'', zegt Frans Timmermans in #Op1. ''Hij is een van ...",Op1,none
IitXlH3oMWw,2023-11-18,youtube#video,Het is tijd. Kies Dilan.,Het is tijd. Tijd voor een frisse start. Kies Dilan. Wil je niets missen van Dilan en alles wat er bij de VVD gebeurt? Abonneer!,VVD,none
1X_WCWmSs54,2023-11-18,youtube#video,Dilan Yeşilgöz-Zegerius bij het Debat van het Zuiden,Wil je niets missen van Dilan en alles wat er bij de VVD gebeurt? Abonneer!,VVD,none
mN-yz1HRI58,2023-11-18,youtube#video,VVD blijft in peilingen erg groot: &#39;En dat ondanks alle schandalen&#39;,Dit is een fragment uit The Friday Move met Wilfred Genee. Aan tafel zitten Mats Akkerman en Mona Keijzer (BBB) om te praten ...,BNR,none
_mVs3UoqNrQ,2023-11-18,youtube#video,"‘Klaar met oude politiek’, wat bedoelt de VVD daarmee?","Dilan Yeşilgöz, ooit actief voor de SP, maakt carrière binnen de VVD. Via de Amsterdamse gemeenteraad en de Tweede Kamer ...",Nieuwsuur,none
oX8bYGib9Ks,2023-11-19,youtube#video,VVD-lijsttrekker Dilan Yeşilgöz: &#39;Oplossingen Wilders maken land kapot&#39;,"Volgens VVD-lijsttrekker Dilan Yeşilgöz zijn de verschillen tussen de PVV en haar partij ""levensgroot"". Ze ziet op dit moment niet ...",WNL,none
JhYG3_T4tZA,2023-11-19,youtube#video,VVD-campagne &#39;Mensen stemmen toch wel op ons&#39; | Plakshot (S5),"In Plakshot geeft Roel Maalderink met straatinterviews, sketches en parodieën zijn scherpe blik op de actualiteit én legt hij de ...",Plakshot | VPRO,none
5LS50xjvVUo,2023-11-19,youtube#video,Elke generatie een eigen leider. Kies Dilan.,Wil je niets missen van Dilan en alles wat er bij de VVD gebeurt? Abonneer!,VVD,none
E64TRFgXrz0,2023-11-19,youtube#video,Onze lijsttrekker Dilan Yeşilgöz-Zegerius bij het Jeugdjournaal Verkiezingsdebat,Wil je niets missen van Dilan en alles wat er bij de VVD gebeurt? Abonneer!,VVD,none
efQSUwdf1C4,2023-11-20,youtube#video,Geer Emigreer | Even Tot Hier | Seizoen 10,Gerard Joling ziet het niet zitten dat Frans Timmermans van GroenLinks-PvdA mensen met een hoog inkomen meer wil belasten.,Even Tot Hier,none
yrwlX9UKq1U,2023-11-20,youtube#video,VVD en NSC sluiten Timmermans niet uit. En met hem erbij verandert er dus niets aan het asielbeleid,,PVVpers,none
B7XtQJ8t3Qc,2023-11-20,youtube#video,Onze lijsttrekker Dilan Yeşilgöz-Zegerius bij WNL op Zondag,Wil je niets missen van Dilan en alles wat er bij de VVD gebeurt? Abonneer!,VVD,none
v28saDIJ6Oc,2023-11-20,youtube#video,Nederland heeft nu een asielcrisis omdat de VVD de afgelopen jaren het D66-beleid heeft uitgevoerd!,,PVVpers,none
D505yuZ3LzQ,2023-11-21,youtube#video,Onze lijsttrekker Dilan Yeşilgöz-Zegerius bij het EenVandaag Verkiezingsdebat,Wil je niets missen van Dilan en alles wat er bij de VVD gebeurt? Abonneer!,VVD,none
g6Znk_4tpFo,2023-11-21,youtube#video,Wat vinden mensen van  Dilan Yeşilgöz (VVD)? &#39;Goeie vervanger voor Rutte&#39;,"In aanloop naar de verkiezingen gaat politiek verslaggever van WNL Tessa van Viegen gaat 'De Markt Op', om aan burgers te ...",WNL,none
GhjVidmEU_Q,2023-11-21,youtube#video,Paniek bij de VVD,,PVVpers,none
O31xTbbyRgs,2023-11-21,youtube#video,Wie is toch die leuke hond van VVD-leider Dilan Yeşilgöz?,Lijsttrekker van de VVD Dilan Yeşilgöz hoopt deze verkiezingen de grootste te worden en namens haar partij premier te worden ...,WNL,none
j0FvFOrJ4fY,2023-11-21,youtube#video,Onze lijsttrekker Dilan Yeşilgöz-Zegerius bij BEAU,Wil je niets missen van Dilan en alles wat er bij de VVD gebeurt? Abonneer!,VVD,none
WesU9ZpSERw,2023-11-21,youtube#video,Lijsttrekker Dilan Yeşilgöz-Zegerius bij NOS over leiderschap,Wil je niets missen van Dilan en alles wat er bij de VVD gebeurt? Abonneer!,VVD,none
kVRZiU8YmQU,2023-11-21,youtube#video,Yeşilgöz (VVD) over uitspraken Omtzigt bij Buitenhof: ‘Niet veel wijzer van geworden’,"VVD-leider Dilan Yeşilgöz vindt dat Pieter Omtzigt (NSC) nog steeds onduidelijk is over het premierschap, ondanks zijn woorden ...",WNL,none
x4JuZzYlB-k,2023-11-21,youtube#video,LEF halveert de VVD,VVD WEG ERMEE. LEF brengt een cadeautje aan de VVD om ze te herinneren aan alle schandalen die ze hebben veroorzaakt: ...,LEF - Voor de Nieuwe Generatie,none
88MV4JmIO7E,2023-11-21,youtube#video,Yeşilgöz (VVD) over aanval op Baudet: ‘Blijf met je poten van politici af’,Gisteravond werd FVD-leider Thierry Baudet in een Gronings café met een bierflesje op zijn hoofd geslagen. VVD-leider Dilan ...,WNL,none
4ojjm2ZRNRI,2023-11-21,youtube#video,Onze lijsttrekker Dilan Yeşilgöz-Zegerius bij het NOS-slotdebat,Wil je niets missen van Dilan en alles wat er bij de VVD gebeurt? Abonneer!,VVD,none
HG_28ZDaW_4,2023-11-21,youtube#video,VVD-lijsttrekker Dilan Yeşilgöz: &#39;Houding Wilders richting Rusland heel zorgelijk&#39;,Nederland moet Oekraïne volop blijven steunen in de oorlog tegen Rusland. Dat zegt VVD-lijsttrekker Dilan Yeşilgöz. Lees meer: ...,WNL,none
3z2qHmpgY1U,2023-11-21,youtube#video,TERUGKIJKEN | NOS Nederland Kiest: Het Debat (deel 1),De NOS bracht de avond voor de verkiezingen het slotdebat. In dit deel debatteerden eerst de kleinere partijen met elkaar.,NOS,none
hDav4uSp-68,2023-11-21,youtube#video,Dilan Yesilgöz: VVD niet in kabinet met premier Geert Wilders,De VVD neemt niet deel aan het kabinet als Geert Wilders premier wordt. Dat zegt Dilan Yesilgöz in het radioprogramma Sven op ...,WNL,none
wVD1FTHNJyo,2023-11-22,youtube#video,"Driestrijd VVD, GroenLinks-PvdA en PVV barst los: wie trekt aan het langste eind?","Met het slotdebat achter de rug is het tijd om te stemmen. De grote vraag is wie de grootste partij wordt, want het lijkt een driestrijd ...",WNL,none
3nVYplplsL8,2023-11-22,youtube#video,"VVD, PVV en GroenLinks-PvdA gaan nek-aan-nek: &#39;Weet niet of regering met Wilders goed nieuws is&#39;","Dit is een fragment uit BNR's Big Five met presentator Diana Matroos. Te gast is Bas Jacobs, Hoogleraar economie en ...",BNR,none
fCbHz_y-FlU,2023-11-22,youtube#video,&#39;VVD geschrokken dat ze Wilders weer relevant hebben gemaakt&#39; | De Campagne Stemming | NPO Radio 1,Het is verkiezingsdag! Xander van der Wulp en Joost Vullings praten je nog één keer bij over de campagne. In deze Campagne ...,NPO Radio 1,none
l6AlcDPBoWY,2023-11-22,youtube#video,BVNL-lijsttrekker Wybren van Haga maakt balans op van 13 jaar VVD: &quot;Erfenis om te huilen&#39;,Kijk de hele en extra lange uitzending terug in twee delen. Deel 1: ...,Ongehoord Nederland TV,none
